id,title,time,by,score,dead,deleted,descendants,kids,parent,parts,poll,text,type,url,_ctx
32711842,What Hollywood Can Learn from RRR,2022-09-04T11:16:19Z,saikatsg,1,false,false,<null>,<null>,<null>,<null>,<null>,<null>,story,https://www.nationalreview.com/corner/what-hollywood-can-learn-from-rrr/,"{""connection_name"":""hackernews""}"
32711849,Does Popper’s Falsification Principle Itself Need to Be Falsifiable?,2022-09-04T11:18:31Z,yamrzou,1,false,false,<null>,<null>,<null>,<null>,<null>,<null>,story,https://www.cantorsparadise.com/does-poppers-falsification-principle-itself-need-to-be-falsifiable-3f3772e45bcc,"{""connection_name"":""hackernews""}"
32711845,More Recursive Definitions,2022-09-04T11:17:40Z,gbrown_,2,false,false,<null>,<null>,<null>,<null>,<null>,<null>,story,https://www.joachim-breitner.de/blog/792-More_recursive_definitions,"{""connection_name"":""hackernews""}"
32711711,Emergence of mesoscale quantum phase transitions in a ferromagnet,2022-09-04T10:51:20Z,rntn,1,false,false,<null>,<null>,<null>,<null>,<null>,<null>,story,https://www.nature.com/articles/s41586-022-04995-5,"{""connection_name"":""hackernews""}"
32711724,The Case for Std:Optional of Reference Types and Void,2022-09-04T10:53:05Z,todsacerdoti,1,false,false,<null>,<null>,<null>,<null>,<null>,<null>,story,https://ibob.bg/blog/2022/09/04/the-case-for-optional-ref-and-void/,"{""connection_name"":""hackernews""}"
32711726,Why Haskell Is Interesting?,2022-09-04T10:53:29Z,dvfjsdhgfv,5,false,false,<null>,<null>,<null>,<null>,<null>,<null>,story,https://web.archive.org/web/20130823122503/http://www.freesoftwaremagazine.com/articles/haskell,"{""connection_name"":""hackernews""}"
32711775,Soldiers test integrated augmented reality tech with Stryker vehicles,2022-09-04T11:03:16Z,MikusR,2,false,false,<null>,<null>,<null>,<null>,<null>,<null>,story,https://www.army.mil/article/259714/soldiers_test_integrated_augmented_reality_tech_with_stryker_vehicles,"{""connection_name"":""hackernews""}"
32711705,"Circular economy could expose children to hazard via old toys, childcare items",2022-09-04T10:50:30Z,rntn,1,false,false,<null>,<null>,<null>,<null>,<null>,<null>,story,https://www.sciencedirect.com/science/article/pii/S2772416622000638,"{""connection_name"":""hackernews""}"
32711696,MIT’s MOXIE experiment reliably produces oxygen on Mars,2022-09-04T10:48:34Z,rntn,1,false,false,<null>,<null>,<null>,<null>,<null>,<null>,story,https://news.mit.edu/2022/moxie-oxygen-mars-0831,"{""connection_name"":""hackernews""}"
32711810,Passing a Portal Through Itself – Minutephysics,2022-09-04T11:10:43Z,thecosmicfrog,2,false,false,<null>,<null>,<null>,<null>,<null>,<null>,story,https://www.youtube.com/watch?v=jSMZoLjB9JE,"{""connection_name"":""hackernews""}"
32711826,TrailBlaze – SSH Pentest and Audit,2022-09-04T11:13:14Z,lfaoro,1,false,false,<null>,<null>,<null>,<null>,<null>,<null>,story,https://github.com/lfaoro/trailblaze,"{""connection_name"":""hackernews""}"
32711782,The Curious Hole in My Head – Born Without a Left Temporal Lobe,2022-09-04T11:05:03Z,pseudolus,1,false,false,<null>,<null>,<null>,<null>,<null>,<null>,story,https://www.nytimes.com/2022/09/04/science/brain-language-research.html,"{""connection_name"":""hackernews""}"
32711683,Fasttext: Library for efficient text classification and representation learning,2022-09-04T10:44:46Z,memorable,2,false,false,<null>,<null>,<null>,<null>,<null>,<null>,story,https://fasttext.cc/,"{""connection_name"":""hackernews""}"
32711637,Windows Defender issuing false positives for Chromium based apps (Win32/Hive.ZY),2022-09-04T10:34:11Z,YPPH,3,false,false,<null>,<null>,<null>,<null>,<null>,<null>,story,https://old.reddit.com/r/computerviruses/comments/x5idjw/help_behaviorwin32hivezy/,"{""connection_name"":""hackernews""}"
32711688,Nat-Again: IRC NAT helper flaws (CVE-2022-2663),2022-09-04T10:46:05Z,sanqui,2,false,false,<null>,<null>,<null>,<null>,<null>,<null>,story,https://dgl.cx/2022/08/nat-again-irc-cve-2022-2663,"{""connection_name"":""hackernews""}"
32711676,Samply: A work in progress of a command-line profiler for macOS and Linux,2022-09-04T10:42:58Z,tosh,1,false,false,<null>,<null>,<null>,<null>,<null>,<null>,story,https://github.com/mstange/samply,"{""connection_name"":""hackernews""}"
32711591,OMG Ponies (a.k.a. Humanity: Epic Fail) (2009),2022-09-04T10:25:20Z,Tomte,1,false,false,<null>,<null>,<null>,<null>,<null>,<null>,story,https://codeblog.jonskeet.uk/2009/11/02/omg-ponies-aka-humanity-epic-fail/,"{""connection_name"":""hackernews""}"
32711582,Ask HN: Recommendations for “Hacker Fiction” Films?,2022-09-04T10:23:40Z,graderjs,2,false,false,2,"[32711837,32711713]",<null>,<null>,<null>,"It will probably seem really silly, but I loved the vibe of the original Hackers film (90s, anti-corporate, young kids vs world), as well as Johnny Mnemonic.<p>I also enjoyed reading (the 1997 version of) Underground: Tales of Hacking, Madness and Obsession on the Electronic Frontier, as a snapshot of the vibe at that time.<p>The vibe at the time which maybe too glibly and imprecisely: was a strange solution of corporate dystopianism, mixed with a young person&#x27;s rebellion and optimism.<p>I also like the idea of, but never watched War Games (maybe it&#x27;s <i>too</i> old?)<p>I don&#x27;t intend this question to be my personal recommendation solicitations: it should be a chance for anyone to share--but I&#x27;m just trying to give some concrete examples to frame it, which I suppose boils down to (maybe): 80s-90s vibe cyberpunk fictional hacking films, not docos.<p>Does anyone have any good recommendations for some fiction films to watch in this space? Hacker fiction films?",story,<null>,"{""connection_name"":""hackernews""}"
32711741,"US cannabis laws projected to cost generic, brand pharmaceutical firms billions",2022-09-04T10:55:28Z,rntn,1,false,false,<null>,<null>,<null>,<null>,<null>,<null>,story,https://journals.plos.org/plosone/article?id=10.1371/journal.pone.0272492,"{""connection_name"":""hackernews""}"
32711596,Intel shows off 8-wavelength silicon laser,2022-09-04T10:26:28Z,WithinReason,1,false,false,<null>,<null>,<null>,<null>,<null>,<null>,story,https://semiaccurate.com/2022/06/28/intel-shows-off-8-wavelength-silicon-laser/,"{""connection_name"":""hackernews""}"
32711642,"Science Hoaxes, Spoofs, and Nerd Jokes (Video)",2022-09-04T10:35:00Z,nsoonhui,1,false,false,<null>,<null>,<null>,<null>,<null>,<null>,story,https://www.youtube.com/watch?v=QOngA8bBbkg,"{""connection_name"":""hackernews""}"
32711566,Infrastructure Is Architecture (With CDK),2022-09-04T10:19:51Z,kiyanwang,2,false,false,<null>,<null>,<null>,<null>,<null>,<null>,story,https://build.diligent.com/infrastructure-is-architecture-with-cdk-3678073238d5,"{""connection_name"":""hackernews""}"
32711599,Program Synthesis is Possible (2018),2022-09-04T10:27:19Z,xept,2,false,false,<null>,<null>,<null>,<null>,<null>,<null>,story,https://www.cs.cornell.edu/~asampson/blog/minisynth.html,"{""connection_name"":""hackernews""}"
32711609,Tips to Get Started with Cosmopolitan Libc,2022-09-04T10:29:37Z,jpe90,2,false,false,<null>,<null>,<null>,<null>,<null>,<null>,story,https://jeskin.net/blog/getting-started-with-cosmopolitan-libc/,"{""connection_name"":""hackernews""}"
32711772,Cowgod's Chip-8 Technical Reference,2022-09-04T11:01:53Z,tosh,1,false,false,<null>,<null>,<null>,<null>,<null>,<null>,story,http://devernay.free.fr/hacks/chip8/C8TECH10.HTM,"{""connection_name"":""hackernews""}"
32711627,1-Node ClickHouse in Production,2022-09-04T10:32:29Z,amzans,3,false,false,<null>,<null>,<null>,<null>,<null>,<null>,story,https://anthonynsimon.com/blog/clickhouse-deployment/,"{""connection_name"":""hackernews""}"
32711593,Two Issues Styling the Details Element and How to Solve Them (2021),2022-09-04T10:25:33Z,Tomte,1,false,false,<null>,<null>,<null>,<null>,<null>,<null>,story,https://css-tricks.com/two-issues-styling-the-details-element-and-how-to-solve-them/,"{""connection_name"":""hackernews""}"
32711617,"Cloudflare blocks 1776 Solutions LLC, hosting NZ neonazi terror Action Zealandia",2022-09-04T10:30:29Z,wahnfrieden,11,false,false,<null>,<null>,<null>,<null>,<null>,<null>,story,https://twitter.com/keffals/status/1566335693663731712,"{""connection_name"":""hackernews""}"
32711600,Why is Intel's GPU program having problems?,2022-09-04T10:27:52Z,WithinReason,1,false,false,<null>,<null>,<null>,<null>,<null>,<null>,story,https://www.semiaccurate.com/2022/09/02/why-is-intels-gpu-program-having-problems/,"{""connection_name"":""hackernews""}"
