id,title,time,by,score,dead,deleted,descendants,kids,parent,parts,poll,text,type,url,_ctx
34399893,Show HN: Codex – find and replace with multi lines and Tree-sitter queries,2023-01-16T12:20:36Z,gushogg-blake,1,false,false,<null>,<null>,<null>,<null>,<null>,"Find &amp; replace has always felt a bit kludgy for anything more than a simple rename or regex.<p>Here I propose a simple syntax that combines plain text, regexes, and tree-sitter queries, and treats newlines and indentation intuitively.<p>Implementation: <a href=""https:&#x2F;&#x2F;gitlab.com&#x2F;gushogg-blake&#x2F;edita-release&#x2F;-&#x2F;tree&#x2F;0.18.0&#x2F;src&#x2F;modules&#x2F;codex"" rel=""nofollow"">https:&#x2F;&#x2F;gitlab.com&#x2F;gushogg-blake&#x2F;edita-release&#x2F;-&#x2F;tree&#x2F;0.18.0...</a>",story,https://codex-kappa-dusky.vercel.app/,"{""connection_name"":""hackernews""}"
34399780,Google-backed ShareChat cuts 20% workforce to ‘sustain through headwinds’,2023-01-16T12:02:36Z,jiwidi,1,false,false,<null>,<null>,<null>,<null>,<null>,<null>,story,https://techcrunch.com/2023/01/15/sharechat-layoffs/,"{""connection_name"":""hackernews""}"
34399531,Google's Stadia will shut down this week,2023-01-16T11:24:00Z,brandrick,2,false,false,<null>,<null>,<null>,<null>,<null>,<null>,story,https://overkill.wtf/google-stadia-game-streaming-service-will-shut-down-this-week/,"{""connection_name"":""hackernews""}"
34399604,Argument-Dependent Lookup and the Hidden Friend Idiom,2023-01-16T11:34:05Z,ibobev,1,false,false,<null>,<null>,<null>,<null>,<null>,<null>,story,http://modernescpp.com/index.php/argument-dependent-lookup-and-hidden-friends,"{""connection_name"":""hackernews""}"
34399823,Modernizing embedded development on Azure Sphere with Rust,2023-01-16T12:12:08Z,pjmlp,1,false,false,<null>,<null>,<null>,<null>,<null>,<null>,story,https://techcommunity.microsoft.com/t5/internet-of-things-blog/modernizing-embedded-development-on-azure-sphere-with-rust/ba-p/3699383,"{""connection_name"":""hackernews""}"
34399539,The Most Fun Way to Make Your Life Awesome,2023-01-16T11:25:20Z,jonsen,2,false,false,<null>,<null>,<null>,<null>,<null>,<null>,story,https://bakadesuyo.com/2023/01/how-to-be-funnier/,"{""connection_name"":""hackernews""}"
34399738,Open Directory Project: Web Directory of High-Quality Resources,2023-01-16T11:56:18Z,MonkeyClub,1,false,false,<null>,<null>,<null>,<null>,<null>,<null>,story,http://www.odp.org/homepage.php,"{""connection_name"":""hackernews""}"
34399705,Generate Invoices in less than 5 minutes on WhatsApp with Skhokho,2023-01-16T11:49:46Z,berthakgokong,1,false,false,<null>,<null>,<null>,<null>,<null>,<null>,story,https://skolo-online.medium.com/generate-invoices-in-less-than-5-minutes-on-whatsapp-with-skhokho-9f9167219e1,"{""connection_name"":""hackernews""}"
34399659,How much Rust work is going on at Cloudflare?,2023-01-16T11:43:04Z,jgrahamc,2,false,false,<null>,<null>,<null>,<null>,<null>,<null>,story,https://old.reddit.com/r/rust/comments/10c0re0/how_much_rust_work_is_actually_going_on_at/,"{""connection_name"":""hackernews""}"
34399676,Playtesting vs. Beta Testing,2023-01-16T11:45:30Z,ibobev,1,false,false,<null>,<null>,<null>,<null>,<null>,<null>,story,https://stirringdragon.games/playtesting-vs-beta-testing/,"{""connection_name"":""hackernews""}"
34399860,The Moon is Artificial and I can Prove It [video],2023-01-16T12:16:06Z,graderjs,1,false,false,<null>,<null>,<null>,<null>,<null>,<null>,story,https://www.youtube.com/watch?v=DhTagWzkjHk,"{""connection_name"":""hackernews""}"
34399811,There’s No Planet B,2023-01-16T12:09:02Z,nsoonhui,3,false,false,<null>,<null>,<null>,<null>,<null>,<null>,story,https://aeon.co/essays/we-will-never-be-able-to-live-on-another-planet-heres-why,"{""connection_name"":""hackernews""}"
34399727,What does Alan Kay think about “remote work” for collaborative research?,2023-01-16T11:54:58Z,agomez314,1,false,false,<null>,<null>,<null>,<null>,<null>,<null>,story,https://www.quora.com/Could-Xerox-PARC-have-been-done-remotely-with-todays-technology-not-necessarily-methods-What-does-Alan-Kay-think-about-remote-work-for-collaborative-research,"{""connection_name"":""hackernews""}"
34399786,"Alarmed by A.I. Chatbots, Universities Start Revamping How They Teach",2023-01-16T12:04:05Z,dkobia,1,false,false,<null>,<null>,<null>,<null>,<null>,<null>,story,https://www.nytimes.com/2023/01/16/technology/chatgpt-artificial-intelligence-universities.html,"{""connection_name"":""hackernews""}"
34399587,Helping medical doctors and patients in the Foundation Model AI era,2023-01-16T11:31:53Z,ignoramous,1,false,false,<null>,<null>,<null>,<null>,<null>,<null>,story,https://erictopol.substack.com/p/when-md-is-a-machine-doctor,"{""connection_name"":""hackernews""}"
34399871,Use ChatGPT at Its Fullest,2023-01-16T12:17:41Z,TheOmkarBirje,1,false,false,<null>,<null>,<null>,<null>,<null>,<null>,story,https://twitter.com/theomkarbirje/status/1614953949345316866,"{""connection_name"":""hackernews""}"
34399665,Ask HN: Mastodon Accounts to Follow,2023-01-16T11:44:12Z,raphaelj,1,false,false,<null>,<null>,<null>,<null>,<null>,"Hi,<p>I just registered on Mastodon (@raphaelj@mastodon.be) and I&#x27;m looking for great users to follow, similar to HN&#x27;s interests.",story,<null>,"{""connection_name"":""hackernews""}"
34399703,Elixir Database Driver for Firebird: Firebirdex 0.3.6 is released with fixes,2023-01-16T11:49:14Z,mariuz,1,false,false,<null>,<null>,<null>,<null>,<null>,<null>,story,https://www.firebirdnews.org/elixir-database-driver-for-firebird-firebirdex-0-3-6-is-released/,"{""connection_name"":""hackernews""}"
34399805,Pinocchio Virtual Machine: Nearly Practical Verifiable Computation,2023-01-16T12:07:33Z,cinthialedesma,1,false,false,<null>,<null>,<null>,<null>,<null>,<null>,story,https://www.notamonadtutorial.com/pinocchio-virtual-machine-nearly-practical-verifiable-computation/,"{""connection_name"":""hackernews""}"
34399691,Cross-Branch Testing,2023-01-16T11:47:30Z,drothlis,1,false,false,2,"[34399733,34399695,34399694]",<null>,<null>,<null>,<null>,story,https://buttondown.email/hillelwayne/archive/cross-branch-testing/,"{""connection_name"":""hackernews""}"
34399787,German defense minister announces resignation,2023-01-16T12:04:05Z,rntn,8,false,false,<null>,<null>,<null>,<null>,<null>,<null>,story,https://www.dw.com/en/german-defense-minister-announces-resignation/a-64401401,"{""connection_name"":""hackernews""}"
34399790,Fighting games use delay-based and rollback netcode,2023-01-16T12:04:19Z,fzeindl,1,false,false,<null>,<null>,<null>,<null>,<null>,<null>,story,https://arstechnica.com/gaming/2019/10/explaining-how-fighting-games-use-delay-based-and-rollback-netcode/,"{""connection_name"":""hackernews""}"
34399686,U.S. tech firms are replacing workers with cheaper talent in Latin America,2023-01-16T11:47:07Z,impish9208,4,false,false,2,"[34399819,34399801,34399697]",<null>,<null>,<null>,<null>,story,https://restofworld.org/2023/cheap-developers-latin-america-tech-crunch-scarcity/,"{""connection_name"":""hackernews""}"
34399813,How Biden’s microchip ban is curbing China’s AI weapons efforts,2023-01-16T12:09:08Z,rntn,1,false,false,<null>,<null>,<null>,<null>,<null>,<null>,story,https://www.defensenews.com/global/asia-pacific/2023/01/12/how-bidens-microchip-ban-is-curbing-chinas-ai-weapons-efforts/,"{""connection_name"":""hackernews""}"
34399557,Star Sphere – Space Inspiration Project,2023-01-16T11:27:26Z,T-A,1,false,false,<null>,<null>,<null>,<null>,<null>,<null>,story,https://starsphere.sony.com/en/,"{""connection_name"":""hackernews""}"
34399753,Ask HN: Does anybody making good money from Google Adsense?,2023-01-16T11:58:54Z,ms7892,1,false,false,<null>,<null>,<null>,<null>,<null>,"My Google Adsense earning is gradually going down so I want to know is here anybody making a good money from Google Adsense programme. Also, what keywords and niche you&#x27;re following. It&#x27;s ok if you don&#x27;t want to include a link to your website&#x2F;app or blog.<p>Thanks in advance.",story,<null>,"{""connection_name"":""hackernews""}"
34399873,Russian General Disclosed UFOs Are Intelligently Piloted Offworld Craft,2023-01-16T12:17:52Z,graderjs,1,false,false,<null>,<null>,<null>,<null>,<null>,<null>,story,https://unknownboundaries.com/russian-general-fully-disclosed-ufos-not-of-this-world-piloted-by-intelligent-beings/,"{""connection_name"":""hackernews""}"
34399614,Ask HN: What are unusual or surprising jobs around software engineering?,2023-01-16T11:35:38Z,pajuc,2,false,false,<null>,<null>,<null>,<null>,<null>,"I&#x27;ve been a software engineer (and recently manager) since 20+ years. I&#x27;ve been building products all this time, as an employee or contractor. I wonder what alternatives there are to this very normal way of working.<p>For example, there is consulting, teaching. I&#x27;ve also been always interested in focusing on very old tech and keeping it running.<p>I&#x27;m happy to read about anything surprising, inspiring in the field of software. Doesn&#x27;t have to be exciting, just unusual, off the beaten path.",story,<null>,"{""connection_name"":""hackernews""}"
34399835,Link between mental health and ADHD is strong–so why aren't we paying attention?,2023-01-16T12:13:43Z,rntn,1,false,false,1,[34399848],<null>,<null>,<null>,<null>,story,https://medicalxpress.com/news/2023-01-link-mental-health-adhd-strongso.html,"{""connection_name"":""hackernews""}"
34399702,Twitter’s third-party client issue is seemingly a deliberate suspension,2023-01-16T11:49:07Z,klelatti,1,false,false,<null>,<null>,<null>,<null>,<null>,<null>,story,https://techcrunch.com/2023/01/16/twitters-third-party-client-issue-is-seemingly-a-deliberate-suspension/,"{""connection_name"":""hackernews""}"
34399838,Somebody Else Is on the Moon (1977),2023-01-16T12:13:57Z,graderjs,1,false,false,<null>,<null>,<null>,<null>,<null>,<null>,story,https://www.amazon.com/Somebody-Else-Moon-George-Leonard/dp/1522838678,"{""connection_name"":""hackernews""}"
34399598,"ASCII table and history – Or, why does Ctrl+I insert a Tab in my terminal?",2023-01-16T11:33:11Z,sandebert,3,false,false,<null>,<null>,<null>,<null>,<null>,<null>,story,https://bestasciitable.com,"{""connection_name"":""hackernews""}"
