id,title,time,by,score,dead,deleted,descendants,kids,parent,parts,poll,text,type,url,_ctx
35216495,"At this California prison, 'we are no longer prisoners. We are professionals'",2023-03-19T06:14:24Z,Stratoscope,1,false,false,,,,,,,story,https://news.yahoo.com/california-prison-no-longer-prisoners-120030190.html,"{""connection_name"":""hackernews""}"
35216377,On Influence – D.W. Griffith and the no longer relevant,2023-03-19T05:45:54Z,bryanrasmussen,1,false,false,,,,,,,story,https://medium.com/luminasticity/on-influence-d-w-griffith-and-the-no-longer-relevant-cc811ae77f35,"{""connection_name"":""hackernews""}"
35216393,Framework Next Level Event on March 23,2023-03-19T05:50:19Z,subarctic,1,false,false,,,,,,,story,https://frame.work/blog/framework-next-level-event,"{""connection_name"":""hackernews""}"
35216416,Africa Soaks Up the Sun,2023-03-19T05:56:45Z,imartin2k,1,false,false,,,,,,,story,https://cleantechnica.com/2023/03/17/africa-soaks-up-the-sun/,"{""connection_name"":""hackernews""}"
35216341,Ask HN: What is your best duct tape hack ever?,2023-03-19T05:35:09Z,textread,1,false,false,,,,,,,story,https://i.imgur.com/03xbJ.jpg,"{""connection_name"":""hackernews""}"
35216469,Why East Antarctica is a 'sleeping giant' of sea level rise,2023-03-19T06:09:19Z,ComputerGuru,1,false,false,,,,,,,story,https://www.bbc.com/future/article/20230309-climate-change-the-sea-level-rise-locked-in-east-antarctica,"{""connection_name"":""hackernews""}"
35216336,Neurodegenerative disease among male elite football players in Sweden,2023-03-19T05:33:12Z,iflp,1,false,false,,,,,,,story,https://www.thelancet.com/journals/lanpub/article/PIIS2468-2667(23)00027-0/fulltext,"{""connection_name"":""hackernews""}"
35216301,"Novice to research, how to find if the work has previously been done?",2023-03-19T05:25:29Z,textread,1,false,false,,,,,,,story,https://old.reddit.com/r/compsci/comments/11v4aay/novice_to_research_how_to_find_if_the_work_has/,"{""connection_name"":""hackernews""}"
35216298,Ask HN: Why is running OpenMPI inside Docker getting sporadiously slow?,2023-03-19T05:24:42Z,gauss82,1,false,false,,,,,,"I am looking at a legacy code here which is first creating a docker container with cgroups (already disabled this, same behavior), which then run MPI jobs inside the docker container. It&#x27;s fast 70% of the time, but sometimes MPI_AllReduce etc. are really getting slow, 2x up to 10x slower performance hit.
Please do not tell me it&#x27;s a bad idea for using docker&#x2F;k8s for HPC&#x2F;MPI, trust me, I know that... :)
Still, I would really like to understand why docker seems to interfere from time to time here and is killing the performance.<p>Thanks in advance to all techies out there which might bring me on the right track.",story,,"{""connection_name"":""hackernews""}"
35216299,What Is a Good Test Case? [pdf],2023-03-19T05:25:15Z,adityaathalye,1,false,false,,,,,,,story,https://kaner.com/pdfs/GoodTest.pdf,"{""connection_name"":""hackernews""}"
35216293,"Germany, Japan vow to deepen ties on defence, raw materials",2023-03-19T05:23:19Z,mikhael,1,false,false,,,,,,,story,https://www.straitstimes.com/asia/east-asia/germany-japan-vow-to-deepen-ties-on-defence-raw-materials,"{""connection_name"":""hackernews""}"
