id,title,time,by,score,dead,deleted,descendants,kids,parent,parts,poll,text,type,url,_ctx
33296167,China Congress: How one man on a bridge marred Xi Jinping's big moment,2022-10-22T07:02:23Z,rntn,1,false,false,<null>,<null>,<null>,<null>,<null>,<null>,story,https://www.bbc.com/news/world-asia-china-63339816,"{""connection_name"":""hackernews""}"
33296118,Fydetab Duo – hackable Linux tablet hands-on experience,2022-10-22T06:51:56Z,also1412,1,false,false,1,[33296119],<null>,<null>,<null>,<null>,story,https://www.youtube.com/watch?v=FsLxzPLum3w,"{""connection_name"":""hackernews""}"
33296172,Truth You Need to Accept If You Want to Stop Feeling Constantly Overwhelmed,2022-10-22T07:03:19Z,FeaturelessBug,1,false,false,<null>,<null>,<null>,<null>,<null>,<null>,story,https://www.inc.com/jessica-stillman/productivity-oliver-burkeman-mental-health.html,"{""connection_name"":""hackernews""}"
33296185,Life expectancy changes since Covid-19,2022-10-22T07:07:41Z,morsch,2,false,false,<null>,[33296204],<null>,<null>,<null>,<null>,story,https://www.nature.com/articles/s41562-022-01450-3,"{""connection_name"":""hackernews""}"
33296207,Australia to face tougher penalties for serious data breaches,2022-10-22T07:14:42Z,blairhudson,1,false,false,<null>,<null>,<null>,<null>,<null>,<null>,story,https://ministers.ag.gov.au/media-centre/tougher-penalties-serious-data-breaches-22-10-2022,"{""connection_name"":""hackernews""}"
33296093,Former Chinese president Hu Jintao escorted out of party Congress,2022-10-22T06:45:05Z,rntn,2,false,false,1,[33296212],<null>,<null>,<null>,<null>,story,https://www.reuters.com/world/china/former-chinese-president-hu-jintao-escorted-out-party-congress-2022-10-22/,"{""connection_name"":""hackernews""}"
33296214,Sembiance/dexvert: Converts thousands of file formats to modern equivalents,2022-10-22T07:17:35Z,yaddaor,2,false,false,<null>,<null>,<null>,<null>,<null>,<null>,story,https://github.com/Sembiance/dexvert,"{""connection_name"":""hackernews""}"
33296153,A Firewall for Internet of Things,2022-10-22T06:59:21Z,xnonce,2,false,false,<null>,<null>,<null>,<null>,<null>,<null>,story,https://ieeexplore.ieee.org/document/7945418/,"{""connection_name"":""hackernews""}"
33296189,First genetic analysis of a Neanderthal family shows a close-knit community,2022-10-22T07:08:54Z,rntn,1,false,false,<null>,<null>,<null>,<null>,<null>,<null>,story,https://theconversation.com/first-ever-genetic-analysis-of-a-neanderthal-family-paints-a-fascinating-picture-of-a-close-knit-community-192595,"{""connection_name"":""hackernews""}"
33296144,Show HN: Online parser for arbitrary CRDs with sample YAML,2022-10-22T06:58:02Z,skarlso,2,false,false,<null>,<null>,<null>,<null>,<null>,"Hello peeps.<p>I’ve wrote a tool to nicely display crds. I know of docs.crds how is this different? You can paste in the crd and it will generate a sample yaml to boot and you don’t need to point it at a repository. Also it has a cli version. Here is the repo <a href=""https:&#x2F;&#x2F;github.com&#x2F;Skarlso&#x2F;crd-to-sample-yaml"" rel=""nofollow"">https:&#x2F;&#x2F;github.com&#x2F;Skarlso&#x2F;crd-to-sample-yaml</a>.<p>I hope someone finds this useful. Any feedback is always appreciated. :) Thanks.",story,https://crds.cronohub.org,"{""connection_name"":""hackernews""}"
33296155,Dice*: A Formally Verified Implementation of Dice Measured Boot,2022-10-22T06:59:43Z,xnonce,2,false,false,<null>,<null>,<null>,<null>,<null>,<null>,story,https://www.usenix.org/conference/usenixsecurity21/presentation/tao,"{""connection_name"":""hackernews""}"
33296107,Pandemic Side Projects Through the Lens of Show HN,2022-10-22T06:49:06Z,jboynyc,2,false,false,<null>,<null>,<null>,<null>,<null>,<null>,story,https://www.jboy.space/blog/pandemic-side-projects.html,"{""connection_name"":""hackernews""}"
33296032,The Environmentalists Undermining Environmentalism,2022-10-22T06:29:05Z,jseliger,1,false,false,<null>,<null>,<null>,<null>,<null>,<null>,story,https://www.theatlantic.com/ideas/archive/2022/10/environmentalists-nimby-permitting-reform-nepa/671775/,"{""connection_name"":""hackernews""}"
33296157,The effect of instructional priming on postural responses to virtual crowds,2022-10-22T07:00:05Z,xnonce,1,false,false,<null>,<null>,<null>,<null>,<null>,<null>,story,https://ieeexplore.ieee.org/abstract/document/7935622,"{""connection_name"":""hackernews""}"
33296073,Russian University Vows to Build 7nm Chipmaking Tools,2022-10-22T06:40:19Z,throwaway4good,2,false,false,1,[33296227],<null>,<null>,<null>,<null>,story,https://www.tomshardware.com/news/lithograhy-tool-russia-7nm-2028,"{""connection_name"":""hackernews""}"
33296127,Germany at Odds over Chinese Investors,2022-10-22T06:54:19Z,rntn,1,false,false,<null>,<null>,<null>,<null>,<null>,<null>,story,https://www.dw.com/en/german-government-at-odds-on-dealing-with-chinese-investors/a-63521619,"{""connection_name"":""hackernews""}"
33296171,Show HN: Tarik's Book Reviews,2022-10-22T07:03:19Z,tarikguney,1,false,false,<null>,<null>,<null>,<null>,<null>,"Quick book reviews and summaries about leadership, team management, and such.",story,https://www.bookreviews.io/,"{""connection_name"":""hackernews""}"
33296143,A Stream oriented Introduction to jq,2022-10-22T06:57:31Z,ingve,2,false,false,<null>,<null>,<null>,<null>,<null>,<null>,story,https://github.com/pkoppstein/jq/wiki/A-Stream-oriented-Introduction-to-jq,"{""connection_name"":""hackernews""}"
33296029,Video: Building an app to “talk to ghosts” using OpenAI's DaVinci,2022-10-22T06:28:14Z,casualbob_uk,1,false,false,<null>,<null>,<null>,<null>,<null>,<null>,story,https://www.youtube.com/watch?v=px_YUoel8gI,"{""connection_name"":""hackernews""}"
33296195,Dark mode support in the AWS Management Console,2022-10-22T07:10:37Z,robbiet480,2,false,false,<null>,[33296203],<null>,<null>,<null>,<null>,story,https://aws.amazon.com/about-aws/whats-new/2022/10/dark-mode-support-aws-management-console/,"{""connection_name"":""hackernews""}"
33296085,Beatles Revolver: How AI revived a classic,2022-10-22T06:43:12Z,rwmj,2,false,false,<null>,<null>,<null>,<null>,<null>,<null>,story,https://www.bbc.co.uk/news/entertainment-arts-63226914,"{""connection_name"":""hackernews""}"
33296030,"Creative AI Is Here, Whether You Believe in It or Not",2022-10-22T06:28:23Z,imartin2k,3,false,false,<null>,<null>,<null>,<null>,<null>,<null>,story,https://www.jonstokes.com/p/creative-ai-is-here-whether-you-believe,"{""connection_name"":""hackernews""}"
33296193,Republican National Committee sues Google over email spam filters,2022-10-22T07:09:40Z,BerislavLopac,1,false,false,<null>,<null>,<null>,<null>,<null>,<null>,story,https://www.reuters.com/world/us/republican-national-committee-sues-google-over-email-spam-filters-2022-10-22/,"{""connection_name"":""hackernews""}"
33296146,Semiconductor Maker ASML Tries to Evade US-China Chip War,2022-10-22T06:58:25Z,helsinkiandrew,3,false,false,1,[33296147],<null>,<null>,<null>,<null>,story,https://www.bloomberg.com/news/articles/2022-10-21/asml-computer-chip-maker-tries-to-evade-us-china-tension,"{""connection_name"":""hackernews""}"
