id,title,time,by,score,dead,deleted,descendants,kids,parent,parts,poll,text,type,url,_ctx
34858190,"Privilege drop, separation, and restricted-service operating mode in OpenBSD",2023-02-19T15:10:15Z,brynet,3,false,false,1,[34858215],,,,,story,https://sha256.net/privsep.html,"{""connection_name"":""hackernews""}"
34858139,The Bull Case for Rust on the Web,2023-02-19T15:03:39Z,paulgb,3,false,false,1,[34858204],,,,,story,https://driftingin.space/posts/bull-case-for-rust-on-web,"{""connection_name"":""hackernews""}"
34858148,AI assisted pull request comments,2023-02-19T15:04:40Z,pixiemaster,1,false,false,,,,,,,story,https://whatthediff.ai/,"{""connection_name"":""hackernews""}"
34858265,Show HN: Try API7 Cloud and Enterprise API Management Platform,2023-02-19T15:17:43Z,jjzhiyuan,1,false,false,,,,,,,story,https://api7.ai/try,"{""connection_name"":""hackernews""}"
34858260,A Balloon Engineer Explains What’s Up,2023-02-19T15:17:22Z,sam345,1,false,false,1,[34858261],,,,,story,https://www.wsj.com/articles/balloons-spy-high-altitude-stratosphere-ufo-7a8a7110,"{""connection_name"":""hackernews""}"
34858252,"AWS Publishes Reference Architecture, Implementations for Deployment Pipelines",2023-02-19T15:16:36Z,rbanffy,1,false,false,,,,,,,story,https://www.infoq.com/news/2023/02/aws-deployment-pipelines/,"{""connection_name"":""hackernews""}"
34857754,"Ask HN: Are you preparing for WW3? If so, how? If not, why not?",2023-02-19T14:20:14Z,ifyoubuildit,10,false,false,10,"[34857956,34858109,34858091,34858069,34858212,34858104,34857954,34858176,34857912]",,,,"Basically the title. I get the feeling from the news that the ruling class is driving us to war. What&#x27;s a hacker to do?<p>For me, I&#x27;ve leaned heavily on the internet (especially youtube) as a superpower when it comes to learning all kinds of new things. I&#x27;m considering trying to archive as much as I can (even without war, I&#x27;m skeptical that the same quantity and quality of info will be freely available forever).<p>Other than that, I don&#x27;t know. What would folks who had to go through WW2 have told themselves if they could have sent a message back in time?",story,,"{""connection_name"":""hackernews""}"
34858053,πfs – A Data-Free Filesystem,2023-02-19T14:54:37Z,KomoD,2,false,false,,,,,,,story,https://github.com/philipl/pifs,"{""connection_name"":""hackernews""}"
34858209,The Cameras Worked Fine. Their Maker Said They Had Reached Their End of Life,2023-02-19T15:12:05Z,Aloha,1,false,false,1,[34858250],,,,,story,https://www.wsj.com/articles/the-cameras-worked-fine-their-maker-said-they-had-reached-their-end-of-life-b6fd3036,"{""connection_name"":""hackernews""}"
34857876,Key considerations when using lasers to code fruit and vegetables (2017),2023-02-19T14:34:45Z,bryanrasmussen,2,false,false,1,[34858120],,,,,story,https://www.domino-printing.com/en/blog/2017/core-issues-fruit-vegetable-coding,"{""connection_name"":""hackernews""}"
34858122,"Angry Bing chatbot just mimicking humans, say experts",2023-02-19T15:02:15Z,elorant,1,false,false,,,,,,,story,https://techxplore.com/news/2023-02-angry-bing-chatbot-mimicking-humans.html,"{""connection_name"":""hackernews""}"
34858166,The Hallucinatory Walk Through Paris That Inspired Deleuze and Guattari,2023-02-19T15:07:33Z,mmq,1,false,false,,,,,,,story,https://www.newyorker.com/books/page-turner/the-hallucinatory-walk-through-paris-that-inspired-deleuze-and-guattari,"{""connection_name"":""hackernews""}"
34858239,Never Laid Off again neverlaidoffagain,2023-02-19T15:15:30Z,aiquantumedge,1,false,false,,,,,,,story,https://nerdsapps.com/never-laid-off-again-neverlaidoffagain/,"{""connection_name"":""hackernews""}"
34857773,Why does Apple buy to kill service like Primephonic?,2023-02-19T14:22:58Z,OnuRC,2,false,false,,,,,,"https:&#x2F;&#x2F;www.apple.com&#x2F;newsroom&#x2F;2021&#x2F;08&#x2F;apple-acquires-classical-music-streaming-service-primephonic&#x2F;
https:&#x2F;&#x2F;9to5mac.com&#x2F;2022&#x2F;12&#x2F;28&#x2F;primephonic-x-apple-music-where-are-they-now-and-where-is-apple-classical&#x2F;<p>This was a great app but only bought to be entirely killed. There is no news about it or anything anymore. How does this decision make sense? I don&#x27;t it take years to already built app to integrate.",story,,"{""connection_name"":""hackernews""}"
34857861,Space Teriyaki – Visions of space and the future in Japan in the 70s and 80s,2023-02-19T14:33:29Z,graderjs,2,false,false,,,,,,,story,https://50watts.com/filter/space-teriyaki/Space-Teriyaki-7,"{""connection_name"":""hackernews""}"
34857763,Ask HN: Good guide to turn an existing Xcode project into a template?,2023-02-19T14:21:51Z,graderjs,1,false,false,,,,,,"I recently got into MacOS development and totally love it. My hard won new code &#x2F; understanding of Objective-C I realized could be reused for many of my other projects that I would like to realize as MacOS apps. But unfortunately I don&#x27;t think it&#x27;s as simple as just &quot;forking the repo&quot; and starting over. I&#x27;ve searched online a <i>lot</i>, but all the guides are like &quot;1. Open Xcode; 2. Construct this Rube Goldberg machine in 10,000 easy manual steps; 3. Profit&quot; and I really don&#x27;t wanna&#x2F;sure there must be an easier way. No takers?",story,,"{""connection_name"":""hackernews""}"
34857777,KeeWeb keepass compatible password manager is looking for a maintainer,2023-02-19T14:23:29Z,faebi,1,false,false,,,,,,,story,https://github.com/keeweb/keeweb/issues/2022,"{""connection_name"":""hackernews""}"
34858231,Bryce 3D: Making Surreal Trapper Keeper/DnB Art on Windows 95,2023-02-19T15:14:34Z,mariuz,1,false,false,,,,,,,story,https://www.youtube.com/watch?v=EGIwcPA1_34,"{""connection_name"":""hackernews""}"
34858012,Why the Tesla Recall Matters,2023-02-19T14:49:59Z,fortran77,2,false,false,,,,,,,story,https://www.theatlantic.com/ideas/archive/2023/02/tesla-recall-elon-musk-missy-cummings/673124/,"{""connection_name"":""hackernews""}"
34857779,Another Opinion: 5G Fails to Deliver on Promises and Potential,2023-02-19T14:23:32Z,thedriver,2,false,false,,,,,,,story,https://techblog.comsoc.org/2022/12/10/another-opinion-5g-fails-to-deliver-on-promises-and-potential/,"{""connection_name"":""hackernews""}"
34857920,LOL Verifier,2023-02-19T14:39:47Z,bookofjoe,2,false,false,,,,,,,story,https://brianmoore.com/lol-verifier/,"{""connection_name"":""hackernews""}"
34858237,Scalene: A Python CPU/GPU/memory profiler with optimization proposals,2023-02-19T15:15:26Z,pkkm,2,false,false,,,,,,,story,https://github.com/plasma-umass/scalene,"{""connection_name"":""hackernews""}"
34857759,"In a First, a Woman Issues a Thunderstorm Watch, Officials Say",2023-02-19T14:21:02Z,mhb,3,false,false,1,[34857951],,,,,story,https://www.nytimes.com/2023/02/18/us/elizabeth-leitman-storm-watch.html,"{""connection_name"":""hackernews""}"
34857856,50 Watts Books,2023-02-19T14:32:50Z,graderjs,1,false,false,,,,,,,story,https://50wattsbooks.com/,"{""connection_name"":""hackernews""}"
34857766,Tesla driver killed after plowing into firetruck on freeway,2023-02-19T14:22:25Z,magic_man,11,false,false,5,"[34858217,34857832,34858038]",,,,,story,https://apnews.com/article/technology-business-injuries-fires-59d22dced75ec1ce6929c9dfb094524c,"{""connection_name"":""hackernews""}"
34857885,“Former Employee” Reveals Anti-Labour Practices at LTT,2023-02-19T14:36:30Z,YeahThereIs,4,false,false,,,,,,,story,https://old.reddit.com/r/LinusTechTips/comments/115ucm3/ltt_isnt_a_great_employer_has_a_lot_of_antilabour/,"{""connection_name"":""hackernews""}"
34858210,Odd Sketches,2023-02-19T15:12:09Z,pncnmnp,1,false,false,,,,,,,story,https://pncnmnp.github.io/blogs/odd-sketches.html,"{""connection_name"":""hackernews""}"
