id,title,time,by,score,dead,deleted,descendants,kids,parent,parts,poll,text,type,url,_ctx
35051146,The Parable of the Dagger,2023-03-07T03:21:53Z,nvader,1,false,false,,,,,,,story,https://www.lesswrong.com/posts/hQxYBfu2LPc9Ydo6w/the-parable-of-the-dagger,"{""connection_name"":""hackernews""}"
35050770,Microsoft Edge is getting a video upscaler to make blurry old videos look better,2023-03-07T02:27:37Z,mfiguiere,23,false,false,14,"[35050902,35051082,35051109,35050883,35050947]",,,,,story,https://www.theverge.com/2023/3/6/23627080/microsoft-edge-video-upscaling-ai-super-resolution-vsr,"{""connection_name"":""hackernews""}"
35051007,"Mutations in ‘supergene’ cause worker ants to sprout queenlike wings, get lazy",2023-03-07T03:00:17Z,rguiscard,2,false,false,,,,,,,story,https://www.science.org/content/article/lazy-worker-ants-sprout-queenlike-wings-sponge-other-workers,"{""connection_name"":""hackernews""}"
35050922,Do Not Trust Employee Resource Groups,2023-03-07T02:48:25Z,tonystubblebine,2,false,false,,,,,,,story,https://devonprice.medium.com/do-not-trust-employee-resource-groups-ergs-1c671b692039,"{""connection_name"":""hackernews""}"
35051114,"South Dakota UCC amendment would prohibit cryptocurrencies, but not CBDC",2023-03-07T03:16:32Z,walterbell,1,false,false,,,,,,,story,https://cointelegraph.com/news/proposed-south-dakota-amendment-to-ucc-would-prohibit-cryptocurrencies-but-not-cbdc,"{""connection_name"":""hackernews""}"
35051144,“SiriGPT”: I put GPT-3 in iPhone and on my Apple Watch,2023-03-07T03:21:45Z,behnamoh,1,false,false,,,,,,,story,https://www.youtube.com/watch?v=-JlckCXDKL4,"{""connection_name"":""hackernews""}"
35050858,"Discord, or the Death of Lore",2023-03-07T02:39:55Z,pabs3,24,false,false,7,"[35051143,35051121,35051103,35051088,35051124,35051101,35050997]",,,,,story,http://ascii.textfiles.com/archives/5509,"{""connection_name"":""hackernews""}"
35050949,Technical Analysis of Online Meeting Tool with Automatic Language Recognition、,2023-03-07T02:51:20Z,cold_wang,2,false,false,,,,,,"In the era of globalization, attending international conferences and business negotiations has become a requirement for an increasing number of people. However, language barriers often prevent many from participating in such events. To address this issue, our team has developed an online meeting tool that automatically recognizes the language of attendees, providing high-quality simultaneous interpretation services.
Our online meeting tool is built on advanced speech recognition technology. When attendees join a meeting, our tool automatically recognizes their speech and compares the results with a pre-set language library to determine their language. Next, the tool converts the attendees&#x27; speech into the corresponding language text and performs real-time translation. Finally, the translated results are presented to other attendees through simultaneous interpretation, thus achieving the functions of automatic language recognition and simultaneous translation.<p>To ensure translation quality, our online meeting tool employs multiple speech recognition and translation technologies. First, we use deep learning algorithms to recognize the speech of attendees and natural language processing to perform translation. In addition, we combine various technologies such as machine translation and manual proofreading to continually optimize translation quality, ensuring the accuracy and fluency of simultaneous interpretation.<p>Furthermore, our online meeting tool has high adaptability and scalability. It can adapt to different network environments and speech characteristics, accommodate multiple attendees simultaneously, and support multiple languages, including Chinese, English, Japanese, and Korean.<p>In summary, our online meeting tool achieves the functions of automatic language recognition and simultaneous interpretation, enabling easy participation in global conferences and business negotiations. It is built on advanced speech recognition and translation technology, with high adaptability and scalability. If you are interested in our online meeting tool and would like to learn more about its technical details or discuss related technical issues with us, please leave a message below or contact us. We look forward to exchanging ideas and cooperating with you.<p>Then my team has developed it and it&#x27;s free to try
Follow felomeet.com on Twitter @wngyunb2",story,,"{""connection_name"":""hackernews""}"
35050908,"Coinbase Tells User Missing $96,000 After Security Breach Is His Problem",2023-03-07T02:46:06Z,mfiguiere,9,false,false,1,[35051042],,,,,story,https://www.bloomberg.com/news/articles/2023-03-07/coinbase-tells-user-missing-96-000-after-breach-is-his-problem-suit-claims,"{""connection_name"":""hackernews""}"
35050785,Twitter thread with Elon Musk about whether an employee still is employed,2023-03-07T02:29:40Z,philip1209,7,false,false,,,,,,,story,https://twitter.com/elonmusk/status/1632904342566211585,"{""connection_name"":""hackernews""}"
35051136,Show HN: Make your non-native English native,2023-03-07T03:20:24Z,kolchinski,1,false,false,,,,,,"Growing up in an immigrant family, I&#x27;ve been asked to help family members correct their English many times.<p>When the ChatGPT API came out last week, I realized that it&#x27;s now possible to get very reasonable results turning non-native English into native English automatically, including being able to adjust the level of formality.<p>I put up a demo at <a href=""https:&#x2F;&#x2F;www.betterenglishai.com&#x2F;"" rel=""nofollow"">https:&#x2F;&#x2F;www.betterenglishai.com&#x2F;</a> – any feedback, especially from non-native English speakers, would be very welcome.",story,https://www.betterenglishai.com/,"{""connection_name"":""hackernews""}"
35050899,NASA’s Curiosity Views First ‘Sun Rays’ on Mars,2023-03-07T02:44:34Z,sohkamyung,1,false,false,,,,,,,story,https://www.jpl.nasa.gov/news/nasas-curiosity-views-first-sun-rays-on-mars,"{""connection_name"":""hackernews""}"
35050835,"Big Trucks, Jackie Chan Movies, and Cardboard Boxes: How AWS Does DevOps",2023-03-07T02:36:31Z,cebert,2,false,false,,,,,,,story,https://www.buildon.aws/posts/how-amazon-does-devops-in-real-life/?es_id=d96d2848a3,"{""connection_name"":""hackernews""}"
35050732,Your Face Is Your Ticket: A Creepy Convenience,2023-03-07T02:23:19Z,bookofjoe,2,false,false,1,[35050737],,,,,story,https://www.wsj.com/articles/your-face-is-your-ticket-a-creepy-convenience-99ca3bdf,"{""connection_name"":""hackernews""}"
35051094,Intel Continues with More Big-Time Optimizations to the Linux Kernel,2023-03-07T03:14:31Z,ashvardanian,2,false,false,,,,,,,story,https://www.phoronix.com/news/Intel-rcuref-Linux-Speed-Up,"{""connection_name"":""hackernews""}"
35050870,"Pandas 2.0 and Its Ecosystem (Arrow, Polars, DuckDB)",2023-03-07T02:41:29Z,tomrod,1,false,false,,,,,,,story,https://airbyte.com/blog/pandas-2-0-ecosystem-arrow-polars-duckdb,"{""connection_name"":""hackernews""}"
35050878,Meltwater Pulse 1A,2023-03-07T02:42:32Z,privong,1,false,false,1,[35050943],,,,,story,https://en.wikipedia.org/wiki/Meltwater_pulse_1A,"{""connection_name"":""hackernews""}"
35050898,Designing Sound – WWDC 2017 (2017),2023-03-07T02:44:17Z,eigen-vector,1,false,false,,,,,,,story,https://developer.apple.com/videos/play/wwdc2017/803/,"{""connection_name"":""hackernews""}"
35050915,Atlassian to shed 5 per cent of workers,2023-03-07T02:47:23Z,rstuart4133,4,false,false,,,,,,,story,https://www.abc.net.au/news/2023-03-07/atlassian-cuts-5-per-cent-of-work-force-tech-industry-layoffs/102062078,"{""connection_name"":""hackernews""}"
35051111,Squadcast Community: For the SRE people to share and interact,2023-03-07T03:16:14Z,modhilal,1,false,false,1,[35051112],,,,,story,https://community.squadcast.com/view/home,"{""connection_name"":""hackernews""}"
35051022,Fixing Reboot in ZynqMP Platform Management Unit Firmware,2023-03-07T03:03:20Z,pabs3,1,false,false,,,,,,,story,https://bootlin.com/blog/fixing-reboot-in-zynqmp-pmu-firmware/,"{""connection_name"":""hackernews""}"
35051055,gRPC: An Introduction,2023-03-07T03:09:34Z,ShadmanRohan_CS,1,false,false,1,[35051056],,,,,story,https://shadmanrohan.github.io/2022-07-01-gRPC/,"{""connection_name"":""hackernews""}"
35050831,Meta Plans Thousands More Layoffs as Soon as This Week,2023-03-07T02:35:21Z,mfiguiere,9,false,false,1,[35050853],,,,,story,https://www.bloomberg.com/news/articles/2023-03-07/meta-is-said-to-plan-thousands-more-layoffs-as-soon-as-this-week,"{""connection_name"":""hackernews""}"
35051131,Illegal Activities,2023-03-07T03:19:25Z,graderjs,1,false,false,,,,,,,story,https://www.irs.gov/publications/p17,"{""connection_name"":""hackernews""}"
35050921,Chicken Became an American Obsession (2022),2023-03-07T02:47:58Z,mgh2,2,false,false,,,,,,,story,https://www.youtube.com/watch?v=iXuta25LYgc,"{""connection_name"":""hackernews""}"
35050951,Urlgen: A script that generates URL variations to test URL parsers with,2023-03-07T02:51:48Z,sohkamyung,1,false,false,,,,,,,story,https://github.com/bagder/urlgen,"{""connection_name"":""hackernews""}"
35051069,"David Revoy (Comic Artist): “At First, Publishing Under Free Licenses Scared Me”",2023-03-07T03:10:52Z,pabs3,1,false,false,,,,,,,story,https://adrienplazas.com/blog/2023/03/06/david-revoy-comic-artist-at-first-publishing-under-a-free-license-scared-me.html,"{""connection_name"":""hackernews""}"
35050879,90k Miles on My Tesla Model 3 – Maintenance Costs Higher Than Expected,2023-03-07T02:42:34Z,aranchelk,3,false,false,1,[35051040],,,,,story,https://cleantechnica.com/2023/03/06/90000-miles-on-my-tesla-model-3-maintenance-costs-higher-than-expected/,"{""connection_name"":""hackernews""}"
