id,title,time,by,score,dead,deleted,descendants,kids,parent,parts,poll,text,type,url,_ctx
35077094,An Update on Our Team,2023-03-09T01:09:46Z,mooreds,2,false,false,,,,,,,story,https://medium.com/ctolunches/an-update-on-our-team-bb35677bf26a,"{""connection_name"":""hackernews""}"
35076943,Ask HN: Next step in creating a hardware startup?,2023-03-09T00:54:16Z,drekipus,1,false,false,,,,,,"Hey HN.<p>I&#x27;ve got a bit of a project &#x2F; POC, that I want to get out the door, and I&#x27;m trying to figure out what is the best way forward to get an initial investment amount.<p>TLDR: Had a prototype product that people were interested in, I&#x27;ve got enough promise to suggest it might be good, but i don&#x27;t want to get burned by HW costs. How do i get the sale first?<p>Backstory::<p>I used to work in a retail electronics store that sold electrical fittings, many of which are just sold in tubs. people will get what they want and bring it to the counter by the handful, which the salesperson has to identify and put into the POS system.<p>Due to the nature of the products and how varied they are, this often takes a long time to figure out, and staff rotate too quickly for any individual to have a solid eye for identification (of what the part does, let alone the product numbers).<p>I developed a little &quot;part identifier&quot; project (webcam, rpi, AI, whole shebang) that worked remarkedly well. Potenial to save hundreds of hours of time each week and be an cool point of interest for the store.<p>I showed it to a few people, managers, etc, everyone loved it, but as i was an employee of the company, they believed that i should work on it for free and give it to them.<p>They also had a very &quot;don&#x27;t rock the boat&quot; mindset, so no one wanted to show any CxO unless it was a finished product, can handle a beating, and so on (their words). Basically an impossibility for a prototype that i spent a few weekends on.<p>Now::<p>Now, I&#x27;ve moved on (no longer an employee) and the leadership has changed significantly. All C-levels have been replaced or removed, and the company is taking a more &quot;innovative&quot; and positive to change, even some of the managers have changed. ( I&#x27;ve still got some friends in the company that share what&#x27;s going on -- totally different vibe now.)<p>I&#x27;m wondering, if i were to come in as an outsider now, and present the same product -- given that it seems to show a bit of promise, how is the best way to go about it?<p>It&#x27;s still just a prototype, so I&#x27;ll be on my own and will have to find someone to do some more HW design for me (or i try and do it myself which will be inefficient). What is the first step in bootstrapping this? could I get enough information to seek investment or a loan?<p>Some random thoughts:<p>* sketch up some designs what the finished product could look like.<p>* Make a flashy website with the concept art and what it does.<p>* do some rough figures for HW and SW cost. Multiply by 4 and add margin for unit price.<p>* Wrap it up in some attractive, roll-out package.<p>* Get some verified numbers on why it&#x27;s useful for TARGET_COMPANY, how much it could save the company in X amount, etc.<p>* Try and get a chance to present, (concept, package, prototype videos) - to the new CEO &#x2F; leadership team.<p>* Make a second prototype to demo in person ? (original prototype is destroyed)<p>Ideally I want a bit of cash first to fund the production of the product, I don&#x27;t want to put my own money into what could be a flakey business agreement. With atleast one customer I would then have verified the product to adapt and take it elsewhere",story,,"{""connection_name"":""hackernews""}"
35077003,Astro 2.1,2023-03-09T00:59:49Z,clessg,1,false,false,,,,,,,story,https://astro.build/blog/astro-210/,"{""connection_name"":""hackernews""}"
35076941,Writer's Award Winner Philip Clark on the Sounds of New York City: Part II,2023-03-09T00:53:57Z,samclemens,2,false,false,,,,,,,story,https://blogs.bl.uk/americas/2023/02/the-sound-of-new-york-citys-deep-past.html,"{""connection_name"":""hackernews""}"
35077183,Silvergate Has Collapsed,2023-03-09T01:20:16Z,ecliptik,3,false,false,,,,,,,story,https://www.theverge.com/2023/3/8/23631320/silvergate-wind-down-liquidiation-announcement,"{""connection_name"":""hackernews""}"
35076915,Simple Zig+C for WASM audio and graphics (with obligatory doom-in-browser demo),2023-03-09T00:50:35Z,trj,2,false,false,,,,,,,story,https://github.com/ringtailsoftware/zig-wasm-audio-framebuffer,"{""connection_name"":""hackernews""}"
35076922,Ejection of Computer Science from Mathematics,2023-03-09T00:51:22Z,jjgreen,4,false,false,,,,,,,story,https://cs.nyu.edu/pipermail/fom/2023-March/023835.html,"{""connection_name"":""hackernews""}"
35076976,Loom: Cache configuration change leading to account vulnerability,2023-03-09T00:57:15Z,cdme,3,false,false,,,,,,,story,https://www.loom.com/blog/march-7-incident-update,"{""connection_name"":""hackernews""}"
35076919,Bulletin Butter and Jelly: An HTTP bulletin board server for small communities,2023-03-09T00:51:10Z,davidcollantes,2,false,false,,,,,,,story,https://github.com/bbj-dev/bbj,"{""connection_name"":""hackernews""}"
35077113,Glitch Tokens,2023-03-09T01:12:13Z,weatherlight,1,false,false,,,,,,,story,https://www.youtube.com/watch?v=WO2X3oZEJOA,"{""connection_name"":""hackernews""}"
35077171,Train derails on way to load nuclear waste,2023-03-09T01:18:54Z,dlcmh,2,false,false,1,[35077203],,,,,story,https://beyondnuclear.org/train-derails-on-way-to-load-n-waste/,"{""connection_name"":""hackernews""}"
35077169,Control Mario Kart 64 with Your Car over Can Bus,2023-03-09T01:18:37Z,stoppingin,17,false,false,9,"[35077306,35077318]",,,,,story,https://github.com/DanH42/CatchMeIfYouCAN,"{""connection_name"":""hackernews""}"
35077285,5.2% pay raise proposal for federal employees in 2024,2023-03-09T01:33:21Z,darth_avocado,4,false,false,,,,,,,story,https://www.washingtonpost.com/politics/2023/03/08/federal-pay-boost-biden-budget-2023/,"{""connection_name"":""hackernews""}"
35077071,TouchHLE: High-level emulator for iPhone OS apps,2023-03-09T01:06:38Z,kristofferR,1,false,false,,,,,,,story,https://github.com/hikari-no-yume/touchHLE,"{""connection_name"":""hackernews""}"
35077351,Twitter just let its privacy- and security-protecting Tor service expire,2023-03-09T01:41:06Z,aendruk,4,false,false,,,,,,,story,https://www.theverge.com/2023/3/7/23629504/twitter-tor-onion-site-security-certificate-expired,"{""connection_name"":""hackernews""}"
35077413,Can We Program Our Cells?,2023-03-09T01:50:07Z,digital55,1,false,false,,,,,,,story,https://www.quantamagazine.org/can-we-program-our-cells-20230308/,"{""connection_name"":""hackernews""}"
35077261,Nord Stream Sabotage revelations [video][44 mins],2023-03-09T01:30:04Z,LinuxBender,1,false,false,,,,,,,story,https://www.youtube.com/watch?v=i7QMPSM6u-s,"{""connection_name"":""hackernews""}"
35077046,Ask HN: How important is code quality before product market fit?,2023-03-09T01:04:35Z,hanskim,1,false,false,1,[35077154],,,,,story,,"{""connection_name"":""hackernews""}"
35077067,Oso – Authorization Academy,2023-03-09T01:06:14Z,jeanyang,2,false,false,,,,,,,story,https://www.osohq.com/academy,"{""connection_name"":""hackernews""}"
35077288,DuckDuckGo Launches DuckAssist,2023-03-09T01:33:34Z,NdMAND,2,false,false,,,,,,,story,https://spreadprivacy.com/duckassist-launch/,"{""connection_name"":""hackernews""}"
35077108,Disobey 2023 Badge Challenge write up,2023-03-09T01:11:51Z,Sami_Lehtinen,2,false,false,,,,,,,story,https://docs.google.com/document/d/e/2PACX-1vSlvIqVTlUAAgREGvkyI8zH9NceQQjaJE-4oLeP0gpJtMhc99VJe9A0YMemUHTACCINOm4W2PXGNyK-/pub,"{""connection_name"":""hackernews""}"
35077122,PromptLeaks: Reddit Community to Safeguard GPT Prompt Leakage,2023-03-09T01:13:28Z,spyhack,4,false,false,2,"[35077255,35077123]",,,,,story,https://old.reddit.com/r/promptLeaks/,"{""connection_name"":""hackernews""}"
35077239,Template Language for JSON data transformations,2023-03-09T01:27:33Z,koladilip,1,false,false,1,[35077240],,,,,story,https://github.com/rudderlabs/rudder-json-template-engine,"{""connection_name"":""hackernews""}"
35077207,Narco-Satanists and the Murder of Mark Kilroy,2023-03-09T01:22:54Z,pardwulf11,1,false,false,,,,,,,story,https://miami-ghost-chronicles.weebly.com/eerie_news/narco-satanists-and-the-murder-of-mark-kilroy,"{""connection_name"":""hackernews""}"
