id,title,time,by,score,dead,deleted,descendants,kids,parent,parts,poll,text,type,url,_ctx
35301657,Show HN: ChatGPT Plugins are a security nightmare,2023-03-25T11:39:08Z,going_ham,3,false,false,1,[35301678],,,,,story,https://github.com/greshake/llm-security,"{""connection_name"":""hackernews""}"
35301930,Ask HN: Is Google Slowly Dying?,2023-03-25T12:20:03Z,ax0ar,1,false,false,,,,,,"I feel like Google’s search result quality has been steadily declining since at least five years, and from what I’m reading both on HN and on other platforms, people feel the same.<p>Add to that Alphabet’s notorious love for constantly killing products, and I’m wondering how long they will be able to keep this going?<p>With ChatGPT and other AI tools being introduced, will the need and reliance on classic search engines drop quickly or will it take years?<p>Where do you see this going?",story,,"{""connection_name"":""hackernews""}"
35301939,File Expiration Using BPF,2023-03-25T12:21:03Z,todsacerdoti,1,false,false,,,,,,,story,https://hondu.co/blog/file-expiration-using-bpf,"{""connection_name"":""hackernews""}"
35301695,Errors Made by the CDC During Covid-19,2023-03-25T11:44:53Z,johnwdefeo,2,false,false,,,,,,,story,https://papers.ssrn.com/sol3/papers.cfm?abstract_id=4381627,"{""connection_name"":""hackernews""}"
35301694,The Case for Moderation,2023-03-25T11:44:52Z,yamrzou,1,false,false,,,,,,,story,https://samvenis.substack.com/p/the-case-for-moderation,"{""connection_name"":""hackernews""}"
35301714,The Lies We Believe About Ourselves,2023-03-25T11:48:17Z,leroy-is-here,1,false,false,,,,,,,story,https://leroy.works/articles/the-lies-we-believe-about-ourselves/,"{""connection_name"":""hackernews""}"
35301800,Phoenix Hyperspace – taking the deepest possible breath,2023-03-25T12:01:12Z,todsacerdoti,1,false,false,,,,,,,story,https://cohost.org/cathoderaydude/post/1228730-taking-the-deepest-p,"{""connection_name"":""hackernews""}"
35301846,Civilization II,2023-03-25T12:08:05Z,BirAdam,3,false,false,,,,,,,story,https://www.abortretry.fail/p/civilization-ii,"{""connection_name"":""hackernews""}"
35301916,MkDocs – Project Documentation with Markdown,2023-03-25T12:18:18Z,mikecarlton,1,false,false,,,,,,,story,https://www.mkdocs.org/,"{""connection_name"":""hackernews""}"
35301607,Poor weak woman being oppressed in France,2023-03-25T11:30:06Z,mardiyah,2,false,false,,,,,,,story,https://twitter.com/RadioGenova/status/1639589677626793985,"{""connection_name"":""hackernews""}"
35301844,US Restrict Act (TikTok Ban),2023-03-25T12:07:13Z,ashwagary,2,false,false,1,[35301873],,,,,story,https://www.documentcloud.org/documents/23697944-restrict-act-final-text,"{""connection_name"":""hackernews""}"
35301727,"The Death of a Technical Skill (Adobe Flash, 2020) [pdf]",2023-03-25T11:49:18Z,miohtama,2,false,false,1,[35301890],,,,,story,https://john-joseph-horton.com/papers/schumpeter.pdf,"{""connection_name"":""hackernews""}"
35301921,Valuing Banks: Hidden Losses versus Hidden Assets,2023-03-25T12:19:09Z,Bostonian,1,false,false,,,,,,,story,https://www.man.com/maninstitute/valuing-banks-hidden-losses,"{""connection_name"":""hackernews""}"
35301902,Most dengue fever cases are asymptomatic – but they be a driver of viral spread,2023-03-25T12:15:19Z,sohkamyung,1,false,false,,,,,,,story,https://cosmosmagazine.com/health/dengue-fever-contact-tracing/,"{""connection_name"":""hackernews""}"
35301621,Nullification of Laws (U.S. Constitution),2023-03-25T11:31:59Z,punnerud,1,false,false,,,,,,,story,https://en.wikipedia.org/wiki/Nullification_(U.S._Constitution),"{""connection_name"":""hackernews""}"
35301582,Interop: One Protocol to Rule Them All? [pdf],2023-03-25T11:24:46Z,gnufx,1,false,false,,,,,,,story,https://www.cl.cam.ac.uk/~rja14/Papers/interoperability-spw23.pdf,"{""connection_name"":""hackernews""}"
35301639,Tell HN: Dark Sky Is Working,2023-03-25T11:34:40Z,numlocked,4,false,false,2,[35301702],,,,"I have no explanation for this - but Dark Sky is working. I received a rain alert yesterday and thought it was a fluke. But got another push notification this morning, and opened the app to discover it working perfectly. Is anyone else experiencing the same thing? Any theories on what’s happening?",story,,"{""connection_name"":""hackernews""}"
35301624,Kotlin/Wasm,2023-03-25T11:32:03Z,sdeleuze,3,false,false,1,[35301625],,,,,story,https://seb.deleuze.fr/introducing-kotlin-wasm/,"{""connection_name"":""hackernews""}"
35301927,ChatGPT written paper demonstrates opportunities and challenges AI in academia,2023-03-25T12:19:43Z,giuliomagnifico,1,false,false,,,,,,,story,https://www.plymouth.ac.uk/news/paper-written-using-chatgpt-demonstrates-opportunities-and-challenges-of-ai-in-academia,"{""connection_name"":""hackernews""}"
35301620,Timeline of the Russian Invasion of Ukraine,2023-03-25T11:31:37Z,acqbu,1,false,false,,,,,,,story,https://en.wikipedia.org/wiki/Timeline_of_the_Russian_invasion_of_Ukraine,"{""connection_name"":""hackernews""}"
35301717,Over 30M people were under a tornado warning in Mississippi,2023-03-25T11:48:30Z,LinuxBender,1,false,false,2,"[35301856,35301820]",,,,,story,https://www.dailymail.co.uk/news/article-11901179/At-seven-killed-huge-mile-wide-tornado-rips-Mississippi.html,"{""connection_name"":""hackernews""}"
35301711,The Titan review – Netflix sci-fi squanders its premise (2018),2023-03-25T11:47:50Z,walterbell,1,false,false,,,,,,,story,https://www.theguardian.com/film/2018/mar/29/the-titan-review-unexciting-netflix-sci-fi-squanders-its-premise,"{""connection_name"":""hackernews""}"
35301774,How to Check If Something Was Written with AI,2023-03-25T11:58:12Z,belter,2,false,false,,,,,,,story,https://goldpenguin.org/blog/check-for-ai-content/,"{""connection_name"":""hackernews""}"
35301850,Silicon Valley Is Turning into Its Own Worst Fear,2023-03-25T12:08:24Z,xg15,2,false,false,1,[35301932],,,,,story,https://www.buzzfeednews.com/article/tedchiang/the-real-danger-to-civilization-isnt-ai-its-runaway,"{""connection_name"":""hackernews""}"
35301776,API v3 Overview – Open States,2023-03-25T11:58:42Z,djoldman,1,false,false,,,,,,,story,https://docs.openstates.org/api-v3/,"{""connection_name"":""hackernews""}"
