id,title,time,by,score,dead,deleted,descendants,kids,parent,parts,poll,text,type,url,_ctx
34739210,The Dawn of Nuclear Energy Abundance,2023-02-10T13:12:55Z,warrenm,2,false,false,,,,,,,story,https://quillette.com/2023/02/09/the-dawn-of-nuclear-energy-abundance/,"{""connection_name"":""hackernews""}"
34739063,We Should Communicate Probabilities With Flips,2023-02-10T12:59:44Z,csmeyer,2,false,false,,,,,,,story,https://blog.charliemeyer.co/we-should-communicate-probabilities-with-flips/,"{""connection_name"":""hackernews""}"
34739007,Fixing a 3 second lockup in our app by switching from Apollo Client to URQL,2023-02-10T12:53:22Z,lumberjackstian,1,false,false,,,,,,,story,https://kitemaker.co/blog/switching-from-apollo-to-urql,"{""connection_name"":""hackernews""}"
34738796,Is Apple letting another AI opportunity slip away? – Macworld,2023-02-10T12:29:53Z,isaacfrond,4,false,false,3,"[34739102,34738994,34738987]",,,,,story,https://www.macworld.com/article/1507282/apple-generative-ai-chatgpt-bard-bing.html,"{""connection_name"":""hackernews""}"
34738793,"If not vegan, then what?",2023-02-10T12:29:19Z,nsoonhui,1,false,false,1,[34739165],,,,,story,https://aeon.co/essays/if-not-vegan-then-what-an-investigation-of-three-options,"{""connection_name"":""hackernews""}"
34739011,China’s Bid to Improve Food Production? Giant Towers of Pigs,2023-02-10T12:54:01Z,traverseda,2,false,false,1,[34739021],,,,,story,https://www.nytimes.com/2023/02/08/business/china-pork-farms.html,"{""connection_name"":""hackernews""}"
34739191,Britons face 20k digital pound cap under Bank of England plan,2023-02-10T13:10:53Z,jermaustin1,1,false,false,1,[34739248],,,,,story,https://www.reuters.com/markets/currencies/consumers-face-20000-pound-limit-digital-pound-bank-england-says-2023-02-07/,"{""connection_name"":""hackernews""}"
34738847,Ask HN: Which Companies Self-Host?,2023-02-10T12:35:01Z,hugodutka,1,false,false,2,[34738940],,,,"I&#x27;m looking for companies that prefer self-hosting to using cloud services. I&#x27;m building a self-hosted alternative to Gitpod and Github Codespaces that works with Gitlab, Gitea, Gerrit, and any other Git provider that supports SSH. It&#x27;s at https:&#x2F;&#x2F;hocus.dev if you want to check it out. I&#x27;m looking for people who would like to try it out, and I figured such companies may be interested.<p>What companies do you know that self-host?",story,,"{""connection_name"":""hackernews""}"
34738970,"Show HN: I made an automatic, non AI design creator. Free, no signup",2023-02-10T12:49:59Z,jonifico,2,false,false,,,,,,,story,https://www.artify.co/auto/tool,"{""connection_name"":""hackernews""}"
34739032,Twitter Heads in the Direction of Financial Health Under Elon Musk,2023-02-10T12:56:19Z,bilsbie,1,false,false,,,,,,,story,https://whatsuptwitter.wordpress.com/2023/02/09/x/,"{""connection_name"":""hackernews""}"
34739282,"Open VSwitch vs. OpenFlow: What Are They, What’s Their Relationship?",2023-02-10T13:19:47Z,teleforce,1,false,false,,,,,,,story,https://www.fiber-optic-transceiver-module.com/openvswitch-vs-openflow-what-are-they-whats-their-relationship.html,"{""connection_name"":""hackernews""}"
34738783,Early Adopter Program: AI data analytics tool. ChatGPT instead of SQL,2023-02-10T12:28:26Z,an_tonova,2,false,false,1,[34739082],,,,,story,https://www.retable.ai/eap,"{""connection_name"":""hackernews""}"
34739040,Why You'd Make a CEO,2023-02-10T12:57:51Z,4monthsaway,2,false,false,,,,,,,story,https://jjpryor.substack.com/p/why-youd-make-an-amazing-ceo,"{""connection_name"":""hackernews""}"
34738991,"Microsoft to demo its new ChatGPT-like AI in Word, PowerPoint, and Outlook soon",2023-02-10T12:51:40Z,jtbayly,2,false,false,1,[34739004],,,,,story,https://www.theverge.com/2023/2/10/23593980/microsoft-bing-chatgpt-ai-teams-outlook-integration,"{""connection_name"":""hackernews""}"
34738846,Efficient network isolation and load balancing in multi-tenant HPC clusters,2023-02-10T12:34:59Z,trifit,2,false,false,,,,,,,story,https://www.duo.uio.no/handle/10852/65181,"{""connection_name"":""hackernews""}"
34738775,Palloc: DRAM Bank-Aware Memory Allocator [pdf],2023-02-10T12:27:34Z,signa11,3,false,false,,,,,,,story,http://www.ittc.ku.edu/~heechul/papers/palloc-rtas2014.pdf,"{""connection_name"":""hackernews""}"
34739255,GitHub lays off 10% and goes fully remote,2023-02-10T13:17:28Z,Liriel,1,false,false,,,,,,,story,https://techcrunch.com/2023/02/09/github-lays-off-10-and-goes-fully-remote/,"{""connection_name"":""hackernews""}"
34738998,It’s Time to Be Practical About Supply Chain AI,2023-02-10T12:52:04Z,JoachimS,1,false,false,,,,,,,story,https://epsnews.com/2023/02/06/its-time-to-be-practical-about-supply-chain-ai/,"{""connection_name"":""hackernews""}"
34738899,Stamps Back,2023-02-10T12:40:58Z,sam345,2,false,false,,,,,,,story,https://www.youtube.com/watch?v=YUqn1OPxtmE,"{""connection_name"":""hackernews""}"
34738792,Reactivity Without Virtual DOM,2023-02-10T12:29:14Z,Cample,12,false,false,7,"[34739168,34739185,34739249]",,,,,story,https://github.com/Camplejs/Cample.js,"{""connection_name"":""hackernews""}"
34739003,CNET's AI Plagiarism Debacle,2023-02-10T12:52:57Z,type0,1,false,false,,,,,,,story,https://www.plagiarismtoday.com/2023/01/25/cnets-ai-plagiarism-debacle/,"{""connection_name"":""hackernews""}"
34738836,Investigation finds AI algorithms objectify women’s bodies,2023-02-10T12:33:50Z,isaacfrond,4,false,false,3,"[34738944,34738864]",,,,,story,https://www.theguardian.com/technology/2023/feb/08/biased-ai-algorithms-racy-women-bodies,"{""connection_name"":""hackernews""}"
34739112,The Sourdough Framework,2023-02-10T13:04:59Z,OJFord,2,false,false,,,,,,,story,https://github.com/hendricius/the-sourdough-framework,"{""connection_name"":""hackernews""}"
34738791,My Strange Day with Bing’s New AI Chatbot,2023-02-10T12:29:10Z,kalimanzaro,2,false,false,,,,,,,story,https://www.wired.com/story/my-strange-day-with-bings-new-ai-chatbot/,"{""connection_name"":""hackernews""}"
34739067,Inferential Confusion,2023-02-10T13:00:14Z,yamrzou,3,false,false,,,,,,,story,https://en.wikipedia.org/wiki/Inferential_confusion,"{""connection_name"":""hackernews""}"
34739046,Dropbox Data Lake and SQL Validation,2023-02-10T12:58:26Z,avipars,1,false,false,,,,,,,story,https://dropbox.tech/infrastructure/balancing-quality-and-coverage-with-our-data-validation-framework,"{""connection_name"":""hackernews""}"
34738786,2023 State of Databases for Serverless and Edge,2023-02-10T12:28:33Z,tudorg,1,false,false,,,,,,,story,https://leerob.io/blog/backend,"{""connection_name"":""hackernews""}"
34739133,Cork: A fast GUI manager for Homebrew written in SwiftUI,2023-02-10T13:06:44Z,tambourine_man,3,false,false,,,,,,,story,https://github.com/buresdv/Cork,"{""connection_name"":""hackernews""}"
34738743,Lyra Starter Game Source Code Now on GitHub,2023-02-10T12:23:47Z,mariuz,1,false,false,,,,,,,story,https://forums.unrealengine.com/t/lyra-starter-game-source-code-now-on-github/767395,"{""connection_name"":""hackernews""}"
34739250,Musically Active People Have Higher Genetic Risk for Certain Mental Illnesses,2023-02-10T13:16:43Z,kalimanzaro,1,false,false,,,,,,,story,https://neurosciencenews.com/music-genetics-mental-health-22468/,"{""connection_name"":""hackernews""}"
34738950,Ask HN: How to get into Neurotech/BCI?,2023-02-10T12:48:24Z,notmindthegap,3,false,false,,,,,,"I’m a nontechnical healthtech PM with a design&#x2F;UX focus and a med school background, looking for advice on how to get into the Neurotech&#x2F;BCI field.<p>I’ve scoured job listings for the top companies in the space and none seen to be looking for people on the design&#x2F;UX side.<p>I’m curious if getting a Masters in a neuro-related discipline (neuroscience, cogsci, biomedical engineering, etc) to give me a bit more scientific and technical know-how would be wise. Unsure about its practical value.<p>Open to any and all advice. Thanks.",story,,"{""connection_name"":""hackernews""}"
34738813,North Korea presents new fake tanks,2023-02-10T12:31:51Z,hubraumhugo,8,false,false,1,[34739237],,,,,story,https://twitter.com/AFVRec_/status/1623754372663443459,"{""connection_name"":""hackernews""}"
34739005,"Mixing R, Python, and Perl in 14 lines of code",2023-02-10T12:53:06Z,pmoriarty,1,false,false,,,,,,,story,https://www.johndcook.com/blog/2012/02/09/mixing-r-python-and-perl-in-13-lines-of-code/,"{""connection_name"":""hackernews""}"
34739252,A dense ring of the trans-Neptunian object Quaoar outside its Roche limit,2023-02-10T13:16:49Z,bookofjoe,1,false,false,,,,,,,story,https://www.nature.com/articles/s41586-022-05629-6,"{""connection_name"":""hackernews""}"
34739061,‘Sam? Are you there? ’ The bizarre and brutal final hours of FTX,2023-02-10T12:59:35Z,keltex,1,false,false,,,,,,,story,https://www.ft.com/content/6e912f25-f1b7-4b19-b370-007fbc867246,"{""connection_name"":""hackernews""}"
34738861,The Balthazar laptop: An all-European RISC-V computer,2023-02-10T12:37:11Z,leephillips,8,false,false,1,[34739164],,,,,story,https://www.theregister.com/2023/02/09/balthazar_free_hardware_laptop/,"{""connection_name"":""hackernews""}"
34739163,How I Use My Mouse,2023-02-10T13:08:46Z,Sujeto,2,false,false,,,,,,,story,https://github.com/madprops/blog/blob/main/mouse.md,"{""connection_name"":""hackernews""}"
34739016,FOSS could be an unintended victim of EU crusade to make software more secure,2023-02-10T12:54:15Z,JoachimS,7,false,false,1,[34739142],,,,,story,https://www.theregister.com/2023/01/30/opinion_eu_foss_security/,"{""connection_name"":""hackernews""}"
34739068,Another failed crypto game project,2023-02-10T13:00:34Z,elariumisascam,2,false,false,,,,,,,story,https://old.reddit.com/r/Ultra_io/comments/10yq55t/elarium_project_not_paying_the_team/,"{""connection_name"":""hackernews""}"
34739186,India finds 5.9M tonnes lithium deposits,2023-02-10T13:10:31Z,Brajeshwar,4,false,false,,,,,,,story,https://www.hindustantimes.com/india-news/india-finds-5-9-million-tonnes-lithium-deposits-in-jammu-and-kashmir-101676000517859.html,"{""connection_name"":""hackernews""}"
34738838,Building a Rust parser using Pest and PEG,2023-02-10T12:33:57Z,asimpletune,3,false,false,,,,,,,story,https://blog.logrocket.com/building-rust-parser-pest-peg/,"{""connection_name"":""hackernews""}"
34738925,Volar: A New Beginning,2023-02-10T12:44:03Z,royjacobs,2,false,false,,,,,,,story,https://blog.vuejs.org/posts/volar-a-new-beginning.html,"{""connection_name"":""hackernews""}"
34738726,Integer Log10 in Rust and C,2023-02-10T12:21:22Z,dgacmu,1,false,false,,,,,,,story,https://da-data.blogspot.com/2023/02/integer-log10-in-rust-and-c.html,"{""connection_name"":""hackernews""}"
34738958,Design a chat system[Text style],2023-02-10T12:48:54Z,willem19x,5,false,false,,,,,,,story,https://nintyzeros.substack.com/p/interview-session-design-a-chat-system,"{""connection_name"":""hackernews""}"
