id,title,time,by,score,dead,deleted,descendants,kids,parent,parts,poll,text,type,url,_ctx
35054443,Fatberg,2023-03-07T12:10:15Z,mromanuk,1,false,false,,,,,,,story,https://en.wikipedia.org/wiki/Fatberg,"{""connection_name"":""hackernews""}"
35054438,Top Generative AI-Based Programming Tools (For Developers),2023-03-07T12:09:38Z,unripe_syntax,1,false,false,,,,,,,story,https://pub.towardsai.net/top-17-generative-ai-based-programming-tools-for-developers-652977ac47b4,"{""connection_name"":""hackernews""}"
35054460,Nuclear Powered Bitcoin Mining,2023-03-07T12:12:02Z,aphroz,2,false,false,,,,,,,story,https://www.coindesk.com/business/2023/03/06/terawulf-starts-nuclear-powered-bitcoin-mining-with-nearly-8000k-rigs-at-nautilus-facility/,"{""connection_name"":""hackernews""}"
35054484,Dutch authorities want to use private commercial DNA databases for cold cases,2023-03-07T12:14:53Z,belter,1,false,false,,,,,,,story,https://nltimes.nl/2023/03/06/dutch-authorities-want-use-private-commercial-dna-databases-cold-cases,"{""connection_name"":""hackernews""}"
35054470,How the Web Became Unreadable (2016),2023-03-07T12:13:46Z,xept,2,false,false,,,,,,,story,https://www.wired.com/2016/10/how-the-web-became-unreadable/,"{""connection_name"":""hackernews""}"
35054337,Please don't use Discord for FOSS projects,2023-03-07T11:55:44Z,pmoriarty,4,false,false,,,,,,,story,https://drewdevault.com/2021/12/28/Dont-use-Discord-for-FOSS.html#,"{""connection_name"":""hackernews""}"
35054312,"Linus Torvalds: if you cannot explain a merge, then JUST DON'T DO IT",2023-03-07T11:52:09Z,sathishmanohar,4,false,false,1,[35054383],,,,,story,https://lore.kernel.org/lkml/63efd7ab.170a0220.3442b.6609@mx.google.com/t/#u,"{""connection_name"":""hackernews""}"
35054199,Basaran is an open-source alternative to the OpenAI text completion API,2023-03-07T11:35:44Z,thunderbong,1,false,false,,,,,,,story,https://github.com/hyperonym/basaran,"{""connection_name"":""hackernews""}"
35054230,Another Attempt at a “Unit Test”,2023-03-07T11:40:34Z,signa11,2,false,false,,,,,,,story,https://boston.conman.org/2023/03/06.1,"{""connection_name"":""hackernews""}"
35054268,Space Goods – The Next Generation Wellness Brand,2023-03-07T11:45:20Z,capableweb,1,false,false,,,,,,,story,https://spacegoods.com/,"{""connection_name"":""hackernews""}"
35054395,"Ask HN: React vs. Angular vs. Vue, which and why?",2023-03-07T12:04:04Z,sh_tomer,1,false,false,,,,,,"Lot&#x27;s of content around these frameworks over the web, but I&#x27;m interested in most recent opinions, as things constantly change.<p>How did you choose the right framework for your company or product?",story,,"{""connection_name"":""hackernews""}"
35054177,"WhatsApp agrees to comply fully with EU rules, informing users better",2023-03-07T11:32:00Z,taubek,1,false,false,,,,,,,story,https://ec.europa.eu/commission/presscorner/detail/en/ip_23_1302,"{""connection_name"":""hackernews""}"
35054287,Ask HN: Musical archive needs your help - Safety ML filter for 200K+ photos,2023-03-07T11:47:13Z,panosfilianos,2,false,false,1,[35054303],,,,"Hello everyone,<p>A friend is working on one of the largest musical historical archives as an archivist. His team has been tasked with going through the personal archive of a donor.<p>The archive contains hundreds of thousands of pictures which are downloaded with random filenames from standard browsing from that donor.<p>The issue is that the archive includes useful pictures mixed together with adult pictures with no way to distinguish between them besides manual review. They have been working on this for weeks and they have a ton more pictures to go through.<p>Is there any software I can help them put together to make the distinguish automatically with a good accuracy? Even sorting (possibly adult&#x2F; possibly safe) is good enough. I am SWE myself, so I can create something fast in many langugaes (especially Python and JS).<p>The archive pertains to one of the greatest opera singers of the 20th century and is the largest to date, so your help here will be meaningful.<p>Thanks a lot!",story,,"{""connection_name"":""hackernews""}"
35054278,Atlassian lay off 500 staff,2023-03-07T11:45:54Z,sytringy05,4,false,false,,,,,,,story,https://www.theguardian.com/technology/2023/mar/07/atlassian-to-axe-500-jobs-with-the-heaviest-of-hearts,"{""connection_name"":""hackernews""}"
35054274,Ask HN: Name popular apps that have better open-source alternatives?,2023-03-07T11:45:38Z,node_monk,3,false,false,3,"[35054380,35054289]",,,,"I can start -<p>VLC &gt; any media player |
Bitwarden &gt; Lastpass |
Excalidraw &gt; FigJam",story,,"{""connection_name"":""hackernews""}"
35054510,Explaining “Economic Moat”,2023-03-07T12:18:06Z,ahobb,2,false,false,,,,,,,story,https://bb-economy.com/2023/economic_moat/,"{""connection_name"":""hackernews""}"
35054163,RJIT a New JIT for Ruby,2023-03-07T11:29:53Z,pmarin,2,false,false,,,,,,,story,https://github.com/ruby/ruby/pull/7448,"{""connection_name"":""hackernews""}"
35054439,Dedup-ing LAION (60M duplicates) and ImageNet (1.2M duplicates) with fastdup,2023-03-07T12:09:53Z,dnth,1,false,false,1,[35054440],,,,,story,https://www.youtube.com/watch?v=s6qamoFzyis,"{""connection_name"":""hackernews""}"
35054400,"Refreshed Interface for Google Drive, Docs, Sheets, and Slides",2023-03-07T12:04:22Z,lexapro,1,false,false,,,,,,,story,https://workspaceupdates.googleblog.com/,"{""connection_name"":""hackernews""}"
35054153,Avoiding Single-Point-of-Failure and Securing the Root Infrastructure: TPM 2.0,2023-03-07T11:28:47Z,hardenedvault,2,false,false,,,,,,,story,https://hardenedvault.net/blog/2023-03-07-tpm2-ref-firmware-security/,"{""connection_name"":""hackernews""}"
35054447,NASA Maps Carbon of 10B Individual Trees,2023-03-07T12:10:32Z,w-m,1,false,false,1,[35054448],,,,,story,https://svs.gsfc.nasa.gov/5031,"{""connection_name"":""hackernews""}"
35054425,Ask HN: What do you think about the noestimates movement?,2023-03-07T12:08:12Z,baby,1,false,false,1,[35054469],,,,,story,,"{""connection_name"":""hackernews""}"
35054414,AudioFlux: A Big Features Extraction for Deep Learning Audio,2023-03-07T12:06:22Z,sixall,6,false,false,,,,,,,story,https://github.com/libAudioFlux/,"{""connection_name"":""hackernews""}"
35054420,Shackleton's Endurance: The book that records all disasters at sea,2023-03-07T12:07:18Z,sohkamyung,1,false,false,,,,,,,story,https://www.bbc.com/news/science-environment-64818864,"{""connection_name"":""hackernews""}"
35054476,Show HN: We built a community for IT and tech professionals,2023-03-07T12:14:23Z,rashik98,2,false,false,,,,,,,story,https://www.zluri.com/community/,"{""connection_name"":""hackernews""}"
35054324,Cample.js: Reactivity without virtual DOM,2023-03-07T11:54:04Z,antonmak1,3,false,false,1,[35054325],,,,,story,https://www.npmjs.com/package/cample,"{""connection_name"":""hackernews""}"
35054474,Do physical measures stop or slow down the spread of respiratory viruses?,2023-03-07T12:14:17Z,jessaustin,2,false,false,,,,,,,story,https://www.cochrane.org/CD006207/ARI_do-physical-measures-such-hand-washing-or-wearing-masks-stop-or-slow-down-spread-respiratory-viruses,"{""connection_name"":""hackernews""}"
35054450,The vibrational power of the number 37 (satire),2023-03-07T12:10:35Z,fallat,1,false,false,,,,,,,story,https://www.andreinc.net/2023/03/01/the-magic-of-the-number-37,"{""connection_name"":""hackernews""}"
35054459,Haskell in Enterprise: Interview with Rob Harrison,2023-03-07T12:11:59Z,amalinovic,3,false,false,,,,,,,story,https://serokell.io/blog/haskell-in-enterprise-interview-with-rob-harrison,"{""connection_name"":""hackernews""}"
35054399,Thomas Fitzpatrick,2023-03-07T12:04:16Z,alexmolas,1,false,false,,,,,,,story,https://en.wikipedia.org/wiki/Thomas_Fitzpatrick_(pilot),"{""connection_name"":""hackernews""}"
35054161,"I can create a read-only page, but why not a write-only page?",2023-03-07T11:29:44Z,AndrewDucker,1,false,false,,,,,,,story,https://devblogs.microsoft.com/oldnewthing/20230306-00/?p=107902,"{""connection_name"":""hackernews""}"
35054434,Meta Plans Thousands More Layoffs as Soon as This Week,2023-03-07T12:09:24Z,bluedino,2,false,false,,,,,,,story,https://finance.yahoo.com/news/meta-plans-thousands-more-layoffs-022908179.html,"{""connection_name"":""hackernews""}"
35054245,The Children’s Book That Caused Japan’s Raccoon Problem,2023-03-07T11:42:49Z,thunderbong,1,false,false,,,,,,,story,https://www.smithsonianmag.com/smart-news/childrens-book-behind-japans-raccoon-problem-180954577/,"{""connection_name"":""hackernews""}"
35054175,Evolution of tree roots may have driven mass extinctions,2023-03-07T11:31:47Z,Archelaos,2,false,false,,,,,,,story,https://news.iu.edu/live/news/18907-evolution-of-tree-roots-may-have-driven-mass,"{""connection_name"":""hackernews""}"
35054255,Show HN: ChatGPT Online Bot on GitHub,2023-03-07T11:44:03Z,Nicole9,2,false,false,,,,,,,story,https://github.com/second-state/chat-with-chatgpt,"{""connection_name"":""hackernews""}"
35054265,This Is How They Tell Me the World Ends: The Cyberweapons Arms Race (2021),2023-03-07T11:45:03Z,peter_d_sherman,1,false,false,1,[35054282],,,,,story,https://www.amazon.com/This-They-Tell-World-Ends/dp/1635576059,"{""connection_name"":""hackernews""}"
35054130,Bar Chart Baselines Start at Zero,2023-03-07T11:25:09Z,Amorymeltzer,3,false,false,,,,,,,story,https://flowingdata.com/2015/08/31/bar-chart-baselines-start-at-zero/,"{""connection_name"":""hackernews""}"
35054114,The Universe May Have Started with a Dark Big Bang,2023-03-07T11:23:47Z,wjSgoWPm5bWAhXB,1,false,false,,,,,,,story,https://www.universetoday.com/160285/the-universe-may-have-started-with-a-dark-big-bang/,"{""connection_name"":""hackernews""}"
35054301,Configuring Front Matter with Astro Live,2023-03-07T11:50:00Z,estruyf,1,false,false,1,[35054302],,,,,story,https://www.youtube.com/watch?v=aCkkEDsJgL0,"{""connection_name"":""hackernews""}"
35054146,Longevity company with drug emerges from stealth,2023-03-07T11:27:22Z,mikeforrest,2,false,false,1,[35054477],,,,,story,https://longevity.technology/news/longevity-company-biophysical-therapeutics-emerges-from-stealth/,"{""connection_name"":""hackernews""}"
35054116,Show HN: I built a better UI for ChatGPT,2023-03-07T11:24:06Z,trungdq88,35,false,false,8,"[35054490,35054154,35054453,35054418,35054455,35054307,35054424]",,,,,story,https://www.typingmind.com/,"{""connection_name"":""hackernews""}"
35054139,Creating a Mendix Application with Syncfusion React Components,2023-03-07T11:26:29Z,arunkani,1,false,false,1,[35054140],,,,,story,https://www.syncfusion.com/blogs/post/creating-a-mendix-application-with-syncfusion-react-components.aspx,"{""connection_name"":""hackernews""}"
35054106,Measuring the Gender Gap in Animated Films Using Computer Vision,2023-03-07T11:22:33Z,galacticsquid,3,false,false,1,[35054160],,,,,story,https://betterprogramming.pub/measuring-the-gender-gap-in-animation-using-ai-fac738be4b19,"{""connection_name"":""hackernews""}"
35054109,Show HN: Price Whistle – Get Notified When the Price of Any Product Drops,2023-03-07T11:23:03Z,ifedapo,2,false,false,,,,,,,story,https://pricewhistle.com/,"{""connection_name"":""hackernews""}"
