id,title,time,by,score,dead,deleted,descendants,kids,parent,parts,poll,text,type,url,_ctx
35067537,Intel Engineer Outs Panther Lake Architecture on LinkedIn,2023-03-08T10:59:44Z,rbanffy,1,false,false,,,,,,,story,https://www.tomshardware.com/news/panther-lake-50-percent-more-efficent-vs-alder-lake,"{""connection_name"":""hackernews""}"
35067662,LWE Made Easier to Understand,2023-03-08T11:16:27Z,tapeloop,1,false,false,,,,,,,story,https://medium.com/asecuritysite-when-bob-met-alice/learning-with-errors-and-ring-learning-with-errors-23516a502406,"{""connection_name"":""hackernews""}"
35067674,"Ask HN: Jack of all trade, but master of none?",2023-03-08T11:18:26Z,_448,1,false,false,,,,,,"Jack of all trade, but master of none.<p>Or<p>Master of one, but jack of none.<p>Which type of person one would you prefer?",story,,"{""connection_name"":""hackernews""}"
35067660,Sam Altman invested $180M into a company trying to delay death,2023-03-08T11:16:05Z,voytec,1,false,false,,,,,,,story,https://www.technologyreview.com/2023/03/08/1069523/sam-altman-investment-180-million-retro-biosciences-longevity-death/,"{""connection_name"":""hackernews""}"
35067509,How Britain ceased to be a computing superpower,2023-03-08T10:54:46Z,shaftoe444,2,false,false,,,,,,,story,https://www.telegraph.co.uk/technology/2023/03/07/how-britain-ceased-computing-superpower/,"{""connection_name"":""hackernews""}"
35067654,"Chiptune music, also called keygen music (enjoy)",2023-03-08T11:15:17Z,legocoder,1,false,false,,,,,,,story,https://keygenmusic.tk/,"{""connection_name"":""hackernews""}"
35067607,Show HN: Chroma – One copy of Electron to rule them all,2023-03-08T11:10:03Z,mogery,1,false,false,,,,,,"chroma keeps a central, up-to-date version of Electron, and makes all your installed Electron apps use it, in order to save disk space.<p>Current caveats: linux only, no flatpak or AppImage support. Currently trying ot figure out how to integrate with Flatpak nicely.",story,https://github.com/mogery/chroma,"{""connection_name"":""hackernews""}"
35067603,Intel Continues with More Big-Time Optimizations to the Linux Kernel,2023-03-08T11:09:41Z,isaacfrond,1,false,false,,,,,,,story,https://www.phoronix.com/news/Intel-rcuref-Linux-Speed-Up,"{""connection_name"":""hackernews""}"
35067617,Converting incoming emails on the fly with OpenSMTPD filters,2023-03-08T11:11:16Z,todsacerdoti,1,false,false,,,,,,,story,https://palant.info/2023/03/08/converting-incoming-emails-on-the-fly-with-opensmtpd-filters/,"{""connection_name"":""hackernews""}"
35067550,2023 State of Open Source Report,2023-03-08T11:02:21Z,alexzeitler,1,false,false,,,,,,,story,https://www.openlogic.com/resources/2023-state-open-source-report,"{""connection_name"":""hackernews""}"
35067541,Running your engineering onboarding program,2023-03-08T11:00:29Z,tapanjk,1,false,false,,,,,,,story,https://lethain.com/engineering-onboarding-programs/,"{""connection_name"":""hackernews""}"
35067516,What Plants Are Saying About Us,2023-03-08T10:55:42Z,rbanffy,2,false,false,,,,,,,story,https://nautil.us/what-plants-are-saying-about-us-264593/,"{""connection_name"":""hackernews""}"
35067619,Noam Chomsky: The False Promise of ChatGPT,2023-03-08T11:11:41Z,topherjaynes,2,false,false,,,,,,,story,https://www.nytimes.com/2023/03/08/opinion/noam-chomsky-chatgpt-ai.html,"{""connection_name"":""hackernews""}"
35067520,How Islamic Rule Changed India,2023-03-08T10:56:42Z,NoahRahman1,1,false,false,,,,,,,story,https://www.youtube.com/watch?v=lltSPYLOLyY,"{""connection_name"":""hackernews""}"
35067558,Tank Control Experiments,2023-03-08T11:03:30Z,ibobev,1,false,false,,,,,,,story,https://simblob.blogspot.com/2023/03/tank-control-experiments.html,"{""connection_name"":""hackernews""}"
35067405,Head Skunk,2023-03-08T10:40:51Z,rbanffy,1,false,false,,,,,,,story,https://www.smithsonianmag.com/air-space-magazine/head-skunk-5960121/,"{""connection_name"":""hackernews""}"
35067347,Redefining Developer Experience,2023-03-08T10:32:05Z,fmerian,1,false,false,,,,,,,story,https://begin.com/blog/posts/2023-02-28-redefining-developer-experience,"{""connection_name"":""hackernews""}"
35067355,Building Your Own Mini ChatGPT,2023-03-08T10:33:24Z,nigamanth,1,false,false,,,,,,,story,https://medium.com/mlearning-ai/building-your-own-mini-chatgpt-b2e9716ab119,"{""connection_name"":""hackernews""}"
35067487,HomeAssistant Supervisor Authentication Bypass,2023-03-08T10:52:03Z,_jomo,2,false,false,,,,,,,story,https://www.home-assistant.io/blog/2023/03/08/supervisor-security-disclosure/,"{""connection_name"":""hackernews""}"
35067459,Edith Wilson Kept Herself–and Her Husband–In the White House Magazine,2023-03-08T10:49:07Z,rbanffy,1,false,false,,,,,,,story,https://www.smithsonianmag.com/history/how-edith-wilson-kept-herselfand-her-husbandin-the-white-house-180981712/,"{""connection_name"":""hackernews""}"
35067492,CWT Spectrogram: Synchrosqueezing and Reassign,2023-03-08T10:52:26Z,CMLab,1,false,false,1,[35067493],,,,,story,https://github.com/libAudioFlux/audioFlux/tree/CWT,"{""connection_name"":""hackernews""}"
35067449,A Patchwork of Contradictions and Confusions: Inside the Software Industry [pdf],2023-03-08T10:47:17Z,alexzeitler,2,false,false,,,,,,,story,https://www.socialsciencethatactuallyworks.com/_files/ugd/d59011_f069e39dfe3a4fe6b867244880c2ba29.pdf,"{""connection_name"":""hackernews""}"
35067508,Ask HN: How do you feel about AI-generated writing?,2023-03-08T10:54:44Z,srimukh,1,false,false,,,,,,"I wanted to get your perspective on AI-generated writing. If I were to come across a blog post here that I found interesting but later discovered that it was generated by AI, I would feel a bit off about it.<p>However, if the post contained all the valid and relevant points, does it really matter if it was written by a machine or a human? Is the authenticity of human writing always necessary, or can AI-generated content be just as valuable?<p>I&#x27;m curious to hear your opinions on this matter.",story,,"{""connection_name"":""hackernews""}"
35067358,Cool Designed Carousel,2023-03-08T10:33:55Z,brianzelip,1,false,false,,[35067406],,,,,story,https://www.typescriptlang.org/#migration_title,"{""connection_name"":""hackernews""}"
35067480,Brief Notes on Computer Word and Byte Sizes,2023-03-08T10:51:21Z,sohkamyung,1,false,false,,,,,,,story,https://www.cs.columbia.edu/~smb/blog/2023-03/2023-03-07.html,"{""connection_name"":""hackernews""}"
35067581,Musk apologizes after mocking laid-off Twitter employee with disability,2023-03-08T11:06:59Z,isaacfrond,1,false,false,,,,,,,story,https://www.npr.org/2023/03/08/1161857747/elon-musk-apologizes-after-mocking-laid-off-twitter-employee-with-disability,"{""connection_name"":""hackernews""}"
35067276,A Big Features Extraction for Deep Learning Audio,2023-03-08T10:21:09Z,sherwooddd,8,false,false,,,,,,,story,https://libaudioflux.github.io/post/audio-features/,"{""connection_name"":""hackernews""}"
35067316,Recognition and Rewards at Work,2023-03-08T10:26:35Z,tapanjk,2,false,false,,,,,,,story,https://larahogan.me/blog/what-you-recognize-and-reward/,"{""connection_name"":""hackernews""}"
35067504,How to Use a Yubikey with Fedora Linux,2023-03-08T10:54:09Z,marbu,1,false,false,,,,,,,story,https://fedoramagazine.org/how-to-use-a-yubikey-with-fedora-linux/,"{""connection_name"":""hackernews""}"
35067476,PoPHPularity – Is it decreasing and what to do about it?,2023-03-08T10:50:52Z,otsch,1,false,false,,,,,,,story,https://www.otsch.codes/blog/pophpularity,"{""connection_name"":""hackernews""}"
35067294,Microsoft makes Outlook for Mac free,2023-03-08T10:23:20Z,thunderbong,2,false,false,,,,,,,story,https://arstechnica.com/gadgets/2023/03/microsoft-makes-outlook-for-mac-free-no-office-or-microsoft-365-required/,"{""connection_name"":""hackernews""}"
