id,title,time,by,score,dead,deleted,descendants,kids,parent,parts,poll,text,type,url,_ctx
32078976,Japanese chip plant lightning strike wrecks week's worth of chips,2022-07-13T04:13:21Z,orionion,2,false,false,<null>,<null>,<null>,<null>,<null>,<null>,story,https://www.theregister.com/2022/07/12/japanese_chip_plant_back_online/,"{""connection_name"":""hackernews""}"
32078945,Salesforce gives up another big chunk of office space,2022-07-13T04:07:06Z,dredmorbius,1,false,false,<null>,<null>,<null>,<null>,<null>,<null>,story,https://www.sfchronicle.com/realestate/article/Salesforce-gives-up-another-big-chunk-of-office-17301088.php,"{""connection_name"":""hackernews""}"
32078884,James Webb Space Telescope team quietly releases a picture of Jupiter,2022-07-13T03:55:59Z,perihelions,5,false,false,1,[32078923],<null>,<null>,<null>,<null>,story,https://www.newscientist.com/article/2328348-james-webb-space-telescope-team-quietly-releases-a-picture-of-jupiter/,"{""connection_name"":""hackernews""}"
32078931,Elon Musk's politics trigger strong reactions from Tesla customer,2022-07-13T04:03:53Z,metadat,1,false,false,<null>,<null>,<null>,<null>,<null>,<null>,story,https://www.cnn.com/2022/07/12/business/tesla-elon-musk-brand-politics/index.html,"{""connection_name"":""hackernews""}"
32078731,Airbus A380 Completes Flight Powered by Cooking Oil,2022-07-13T03:27:34Z,prostoalex,5,false,false,5,"[32078998,32079001,32078854]",<null>,<null>,<null>,<null>,story,https://hackaday.com/2022/07/12/airbus-a380-completes-flight-powered-by-cooking-oil/,"{""connection_name"":""hackernews""}"
32078830,Point sampling finally as beautiful as engravers would know how to do in 1800s,2022-07-13T03:46:25Z,DantesKite,1,false,false,<null>,<null>,<null>,<null>,<null>,<null>,story,https://twitter.com/jyzg/status/1538854845574258688,"{""connection_name"":""hackernews""}"
32078949,Choosing a New Comment Policy,2022-07-13T04:07:32Z,Tomte,2,false,false,<null>,<null>,<null>,<null>,<null>,<null>,story,https://scottaaronson.blog/?p=6552,"{""connection_name"":""hackernews""}"
32078785,Prosthaphaeresis,2022-07-13T03:38:06Z,jasonhansel,3,false,false,<null>,<null>,<null>,<null>,<null>,<null>,story,https://en.wikipedia.org/wiki/Prosthaphaeresis,"{""connection_name"":""hackernews""}"
32078964,Twitter vs. Musk Complaint,2022-07-13T04:10:21Z,camjohnson26,4,false,false,<null>,<null>,<null>,<null>,<null>,<null>,story,https://www.documentcloud.org/documents/22084453-twittermuskcomplaint,"{""connection_name"":""hackernews""}"
32078902,GPT-3 prompting: The “hash trick”,2022-07-13T03:59:22Z,goodside,1,false,false,<null>,<null>,<null>,<null>,<null>,<null>,story,https://twitter.com/goodside/status/1547024867215769600,"{""connection_name"":""hackernews""}"
32078946,SpaceX Starship Super Heavy Booster 7 in flames after unexpected ignition,2022-07-13T04:07:17Z,orionion,2,false,false,<null>,<null>,<null>,<null>,<null>,<null>,story,https://www.theregister.com/2022/07/12/spacex_starship/,"{""connection_name"":""hackernews""}"
32078967,How to Solve Valid Palindrome Problem with 1 Line of JavaScript,2022-07-13T04:10:39Z,apmfree,1,false,false,<null>,<null>,<null>,<null>,<null>,<null>,story,https://indepthjavascript.dev/how-to-solve-valid-palindrome-problem-with-1-line-of-javascript,"{""connection_name"":""hackernews""}"
32078950,Looking for Disinformation Database,2022-07-13T04:07:35Z,kuksnasi,1,false,false,<null>,<null>,<null>,<null>,<null>,I am working on a project which involves analyzing behaviors towards disinformation on variety of issues. Is there any existing database that categorizes whether a certain Tweet or online post is a propaganda or not?,story,<null>,"{""connection_name"":""hackernews""}"
32078759,Advanced E.V. Batteries Move from Labs to Mass Production,2022-07-13T03:33:02Z,prostoalex,1,false,false,<null>,<null>,<null>,<null>,<null>,<null>,story,https://www.nytimes.com/2022/07/12/business/electric-vehicle-batteries.html,"{""connection_name"":""hackernews""}"
32078922,“Luna Glass” and “Mars Glass” centrifugal towers could be key to life off-planet,2022-07-13T04:02:47Z,orionion,1,false,false,<null>,<null>,<null>,<null>,<null>,<null>,story,https://www.theregister.com/2022/07/12/the_moon_needs_spinning_gravity/,"{""connection_name"":""hackernews""}"
32078874,BMW starts selling heated seat subscriptions for $18 a month,2022-07-13T03:54:19Z,JamesAdir,1,false,false,<null>,<null>,<null>,<null>,<null>,<null>,story,https://www.theverge.com/2022/7/12/23204950/bmw-subscriptions-microtransactions-heated-seats-feature,"{""connection_name"":""hackernews""}"
32078758,The Network State – Balaji Srinivasan,2022-07-13T03:32:55Z,asasidh,1,false,false,<null>,<null>,<null>,<null>,<null>,<null>,story,https://thenetworkstate.com/,"{""connection_name"":""hackernews""}"
32078765,The Lonely Work of Picking the Universe’s Best Astronomy Pictures,2022-07-13T03:34:28Z,pseudolus,1,false,false,<null>,<null>,<null>,<null>,<null>,<null>,story,https://www.nytimes.com/2022/07/12/science/webb-telescope-pictures.html,"{""connection_name"":""hackernews""}"
32078816,License agreement for the CP/M material presented on this site,2022-07-13T03:43:38Z,sohkamyung,3,false,false,<null>,<null>,<null>,<null>,<null>,<null>,story,http://www.cpm.z80.de/license.html,"{""connection_name"":""hackernews""}"
32078826,Why Netflix’s Loss of Licensed Titles Could Spark a Content Crisis,2022-07-13T03:45:32Z,thesecretceo,1,false,false,<null>,<null>,<null>,<null>,<null>,<null>,story,https://variety.com/vip/how-netflix-originals-cant-make-up-for-licensing-losses-1235313606/,"{""connection_name"":""hackernews""}"
32078749,Rolling your own crypto: Everything you need to build AES from scratch,2022-07-13T03:30:52Z,prostoalex,2,false,false,<null>,<null>,<null>,<null>,<null>,<null>,story,https://github.com/francisrstokes/githublog/blob/main/2022/6/15/rolling-your-own-crypto-aes.md,"{""connection_name"":""hackernews""}"
32078788,"Absolute: Sowing the Seeds of Sustainable, Scalable Agriculture",2022-07-13T03:38:56Z,lawrenceyan,1,false,false,<null>,<null>,<null>,<null>,<null>,<null>,story,https://www.sequoiacap.com/india/article/absolute-sowing-the-seeds-of-sustainable-scalable-agriculture/,"{""connection_name"":""hackernews""}"

