id,title,time,by,score,dead,deleted,descendants,kids,parent,parts,poll,text,type,url,_ctx
35244399,Four ways to fix the bank problem,2023-03-21T10:18:00Z,marban,1,false,false,,,,,,,story,https://www.ft.com/content/70ce4b8a-1310-4e3c-a891-3c34cd313841,"{""connection_name"":""hackernews""}"
35244261,Search-centric AI prompt injection,2023-03-21T09:54:00Z,rcarmo,1,false,false,,,,,,,story,https://sigmoid.social/@Riedl/110058596273757549,"{""connection_name"":""hackernews""}"
35244128,Anomalous intense coherent secondary photoemission from a perovskite oxide,2023-03-21T09:29:59Z,rq1,2,false,false,,,,,,,story,https://www.nature.com/articles/s41586-023-05900-4,"{""connection_name"":""hackernews""}"
35244306,Converting string to enum at the cost of 50 GB: let's analyze the CVE-2020-36620,2023-03-21T10:01:56Z,AndreyKarpov,1,false,false,,,,,,,story,https://pvs-studio.com/en/blog/posts/csharp/1038/,"{""connection_name"":""hackernews""}"
35244375,Growing number of high-security pathogen labs around world raises concerns,2023-03-21T10:13:54Z,pseudolus,2,false,false,,,,,,,story,https://www.science.org/content/article/growing-number-high-security-pathogen-labs-around-world-raises-concerns,"{""connection_name"":""hackernews""}"
35244296,Quantum Computers Break the Internet Starting Now,2023-03-21T09:59:35Z,ashvardanian,1,false,false,,,,,,,story,https://www.youtube.com/watch?v=-UrdExQW0cs,"{""connection_name"":""hackernews""}"
35244357,Elon's Estimator: Etalon,2023-03-21T10:10:55Z,JoelJacobson,2,false,false,,,,,,,story,https://gist.github.com/joelonsql/f10b7b2ac4b5d03e9f18fe3bc9109c5f,"{""connection_name"":""hackernews""}"
35244373,Ask HN: Best computer vision library for TypeScript?,2023-03-21T10:13:50Z,erlich,1,false,false,,,,,,I want to use TS&#x2F;JS for computer vision stuff.<p>What is the best approach? Any good ports of opencv? Is WASM a possibility?,story,,"{""connection_name"":""hackernews""}"
35244230,Ask HN: Should LLM think before answering?,2023-03-21T09:49:34Z,zigzag312,1,false,false,1,"[35244356,35244258]",,,,"ChatGPT can often correct it&#x27;s answer, if a mistake is pointed out. That means it has the correct data, it just doesn&#x27;t know how to retrieve it.<p>So, what if it would try to automatically challenge statements it has made, before giving a final answer. Do you think, it would be possible to improve LLM&#x27;s accuracy with this kind of auto validation feedback loop?<p>Like we need to think before speaking, to consider what we are about to say.",story,,"{""connection_name"":""hackernews""}"
35244321,Team first to detect neutrinos made by a particle collide,2023-03-21T10:04:12Z,pseudolus,1,false,false,,,,,,,story,https://phys.org/news/2023-03-team-neutrinos-particle-collider.html,"{""connection_name"":""hackernews""}"
35244168,“the hat” is an aperiodic monotile,2023-03-21T09:36:32Z,mathgenius,2,false,false,1,[35244270],,,,,story,https://twitter.com/cs_kaplan/status/1637996332475359232,"{""connection_name"":""hackernews""}"
35244398,Alzheimer’s disease: problems with the brain’s energy supply could be a cause,2023-03-21T10:17:53Z,pseudolus,1,false,false,,,,,,,story,https://theconversation.com/alzheimers-disease-problems-with-the-brains-energy-supply-could-be-a-cause-201602,"{""connection_name"":""hackernews""}"
35244239,Marsilio Ficino ⸻ Plato's Translator into Latin,2023-03-21T09:51:26Z,abudabi123,1,false,false,,,,,,,story,https://en.wikipedia.org/wiki/Marsilio_Ficino,"{""connection_name"":""hackernews""}"
35244165,Logging and the Homelab,2023-03-21T09:36:16Z,dracyr,1,false,false,,,,,,,story,https://pv.wtf/posts/logging-and-the-homelab?ref=hn,"{""connection_name"":""hackernews""}"
35244143,Breakthrough discovery challenges current understanding of photoemission,2023-03-21T09:33:04Z,rq1,2,false,false,,,,,,,story,https://phys.org/news/2023-03-breakthrough-discovery-materials-science-current.html,"{""connection_name"":""hackernews""}"
35244107,Open Source API Gateway – From a Piece to a Puzzle,2023-03-21T09:27:21Z,sahil_finch,1,false,false,,,,,,,story,https://www.youtube.com/watch?v=ENui6jp8NvU,"{""connection_name"":""hackernews""}"
35244183,Perpetual Stew,2023-03-21T09:38:37Z,prakhar897,1,false,false,1,[35244206],,,,,story,https://en.wikipedia.org/wiki/Perpetual_stew,"{""connection_name"":""hackernews""}"
35244313,Ask HN: How to convey the importance of generative AI to non-technical people?,2023-03-21T10:03:14Z,fdeage,1,false,false,,,,,,"I noticed a trend recently when comparing LLMs with the previous tech trends (crypto&#x2F;web3&#x2F;NFTs, big data, etc.):<p>* many laypeople think the latter are a big deal, while experts do not (or are split),<p>* many experts think LLMs are a big deal, while most laypeople do not see the point yet.<p>For people working in ML, how do you convey the (probable) future importance of LLMs, and generative AI in general, to non-techies?",story,,"{""connection_name"":""hackernews""}"
35244076,Euthanasia Coaster,2023-03-21T09:23:32Z,logi2mus,2,false,false,,,,,,,story,https://en.wikipedia.org/wiki/Euthanasia_Coaster,"{""connection_name"":""hackernews""}"
35244215,Patent of Capsule Neural Networks: MachineLearning,2023-03-21T09:45:57Z,ZeljkoS,1,false,false,,,,,,,story,https://old.reddit.com/r/MachineLearning/comments/ixm9jo/d_patent_of_capsule_neural_networks/,"{""connection_name"":""hackernews""}"
35244105,EU Cyber Resilience Act Part Two: Updates and Impracticalities,2023-03-21T09:27:16Z,pabs3,2,false,false,,,,,,,story,https://berthub.eu/articles/posts/eu-cra-practicalities/,"{""connection_name"":""hackernews""}"
35244256,Google Suspends Pinduoduo(Temu's Sister App) After Finding Malware in Versions,2023-03-21T09:53:52Z,hitori,1,false,false,,,,,,,story,https://www.bloomberg.com/news/articles/2023-03-21/google-suspends-pdd-s-main-app-after-finding-malware-in-versions,"{""connection_name"":""hackernews""}"
35244271,Who Is Divya Nettimi? First Woman to Start Billion-Dollar Hedge Fund,2023-03-21T09:55:26Z,matthewosds,2,false,false,1,[35244272],,,,,story,https://www.thequint.com/gender/indian-origin-divya-nettimi-becomes-first-woman-to-start-billion-dollar-hedge-fund,"{""connection_name"":""hackernews""}"
