id,title,time,by,score,dead,deleted,descendants,kids,parent,parts,poll,text,type,url,_ctx
33607540,Generative AI: Everything You Need to Know – Uncharted Territories,2022-11-15T10:35:03Z,firstSpeaker,1,false,false,<null>,<null>,<null>,<null>,<null>,<null>,story,https://unchartedterritories.tomaspueyo.com/p/generative-ai-everything-you-need,"{""connection_name"":""hackernews""}"
33607467,Vulcan demos in-house lithium extraction technology VULSORB,2022-11-15T10:26:37Z,Gravityloss,2,false,false,1,[33607575],<null>,<null>,<null>,<null>,story,https://www.greencarcongress.com/2022/11/20221114-vulsorb.html,"{""connection_name"":""hackernews""}"
33607439,"Musk plans to end free lunch at Twitter HQ, claims meals cost $13M a year",2022-11-15T10:23:15Z,pcurve,3,false,false,1,[33607687],<null>,<null>,<null>,<null>,story,https://nypost.com/2022/11/14/musk-plans-to-end-free-lunch-at-twitter-hq-claims-meals-cost-13m-a-year/,"{""connection_name"":""hackernews""}"
33607401,Show HN: Semantic Video Search,2022-11-15T10:19:17Z,warangal,2,false,false,<null>,<null>,<null>,<null>,<null>,"Hi HN, I am Anubhav from Ramanlabs. We have been working on a native gui application to allow users to search any video data( mp4, mkv) or video streams (http&#x2F;rtsp) using computer vision.<p>Application is supposed to work like a video player which displays decoded frames and recognizes objects concurrently, making it an interactive experience. It works in super real-time and only expects a quad-core CPU with AVX2 instructions at minimum.<p>Application is free to download (without any signup&#x2F;account). We are only supporting WINDOWS for now [0]. Even though this is a binary application, we have ZERO telemetry&#x2F;analytics builtin.<p>User interface is limited for now, and definitely needs more work. But we are releasing it here for early feedback&#x2F;bugs.<p>We would love for you to try it out and hear your thoughts&#x2F;feedback.<p>[0] We should also have a linux version ready in few days.",story,https://ramanlabs.in/static/videointel.html,"{""connection_name"":""hackernews""}"
33607501,"This spider web is strong enough for a bird to sit on, a scientific first",2022-11-15T10:30:29Z,jazali,2,false,false,<null>,<null>,<null>,<null>,<null>,<null>,story,https://www.nationalgeographic.com/animals/article/this-spider-web-is-strong-enough-for-a-bird-to-sit-on-a-scientific-first,"{""connection_name"":""hackernews""}"
33607494,Are We Stack-Efficient Yet?,2022-11-15T10:29:37Z,ingve,1,false,false,<null>,<null>,<null>,<null>,<null>,<null>,story,http://arewestackefficientyet.com/,"{""connection_name"":""hackernews""}"
33607646,‘Hack the hackers’: New taskforce to target cybercriminals,2022-11-15T10:49:48Z,taubek,2,false,false,<null>,<null>,<null>,<null>,<null>,<null>,story,https://www.afr.com/politics/federal/australia-to-hack-the-hackers-behind-medibank-attack-o-neil-20221112-p5bxor,"{""connection_name"":""hackernews""}"
33607670,"There are now 8B people on Earth, according to a new U.N. report",2022-11-15T10:52:35Z,isaacfrond,2,false,false,<null>,<null>,<null>,<null>,<null>,<null>,story,https://www.npr.org/2022/11/15/1136709784/there-are-now-8-billion-people-on-earth-according-to-a-new-u-n-report,"{""connection_name"":""hackernews""}"
33607526,Show HN: Moonfisher Web Game,2022-11-15T10:33:24Z,hvidevold,1,false,false,<null>,<null>,<null>,<null>,<null>,<null>,story,https://emnh.no/publish/moonfisher/dist/,"{""connection_name"":""hackernews""}"
33607514,Companies stealing your code from homework/tests,2022-11-15T10:32:30Z,acqbu,2,false,false,<null>,<null>,<null>,<null>,<null>,<null>,story,https://teddit.net/r/webdev/comments/yv2dc7/companies_stealing_your_code_from_homeworktests/,"{""connection_name"":""hackernews""}"
33607593,Implementing Phishing-Resistant MFA [pdf],2022-11-15T10:42:34Z,mikecarlton,1,false,false,<null>,<null>,<null>,<null>,<null>,<null>,story,https://www.cisa.gov/sites/default/files/publications/fact-sheet-implementing-phishing-resistant-mfa-508c.pdf,"{""connection_name"":""hackernews""}"
33607672,More Evidence for Problems in VM Warmup,2022-11-15T10:53:10Z,ltratt,1,false,false,<null>,<null>,<null>,<null>,<null>,<null>,story,https://tratt.net/laurie/blog/2022/more_evidence_for_problems_in_vm_warmup.html,"{""connection_name"":""hackernews""}"
33607606,Delegating trust is hard (infosec edition),2022-11-15T10:43:38Z,mikecarlton,3,false,false,<null>,<null>,<null>,<null>,<null>,<null>,story,https://pluralistic.net/2022/11/09/infosec-blackpill/#on-trusting-trust,"{""connection_name"":""hackernews""}"
33607435,CSS Keylogger,2022-11-15T10:22:47Z,mbarthe,2,false,false,<null>,<null>,<null>,<null>,<null>,<null>,story,https://css-tricks.com/css-keylogger/,"{""connection_name"":""hackernews""}"
33607635,Ask HN: Is MINIX still the go to for learning about operating systems?,2022-11-15T10:48:22Z,sschmitt,3,false,false,3,"[33607790,33607774,33607715]",<null>,<null>,<null>,<null>,story,<null>,"{""connection_name"":""hackernews""}"
33607655,History of Tuxedo Cats: Origins and Ancestry Explained,2022-11-15T10:51:15Z,ohiovr,2,false,false,<null>,<null>,<null>,<null>,<null>,<null>,story,https://petkeen.com/history-of-tuxedo-cats/,"{""connection_name"":""hackernews""}"
33607416,Concerns about Trustcor [Root CA],2022-11-15T10:20:59Z,Rygian,1,false,false,<null>,<null>,<null>,<null>,<null>,<null>,story,https://groups.google.com/a/mozilla.org/g/dev-security-policy/c/oxX69KFvsm4,"{""connection_name"":""hackernews""}"
33607695,Roger Penrose interview: “Consciousness must be beyond computable physics.”,2022-11-15T10:55:57Z,isaacfrond,4,false,false,<null>,<null>,<null>,<null>,<null>,<null>,story,https://www.newscientist.com/article/mg25634130-100-roger-penrose-consciousness-must-be-beyond-computable-physics/,"{""connection_name"":""hackernews""}"
33607617,Tell HN: It's possible to close annoying Twitter's login screen without tricks,2022-11-15T10:46:36Z,tester756,2,false,false,<null>,<null>,<null>,<null>,<null>,Just click sign in button<p>and then there&#x27;s &quot;X&quot; button in the top-left corner,story,<null>,"{""connection_name"":""hackernews""}"
33607710,Explain that parameterized statement in PostgreSQL,2022-11-15T10:58:37Z,todsacerdoti,2,false,false,<null>,<null>,<null>,<null>,<null>,<null>,story,https://www.cybertec-postgresql.com/en/explain-that-parameterized-statement/,"{""connection_name"":""hackernews""}"
33607528,FTX Collapsed Here’s Why (YouTube – CoffeeZilla),2022-11-15T10:33:28Z,robertlagrant,1,false,false,1,[33607529],<null>,<null>,<null>,<null>,story,https://www.youtube.com/watch?v=l3HfrRjWilQ,"{""connection_name"":""hackernews""}"
33607449,MicroPython,2022-11-15T10:24:02Z,tosh,1,false,false,<null>,<null>,<null>,<null>,<null>,<null>,story,https://en.wikipedia.org/wiki/MicroPython,"{""connection_name"":""hackernews""}"
33607694,Twitter engineer calls out Musk for technical incompetence,2022-11-15T10:55:51Z,isaacfrond,2,false,false,<null>,<null>,<null>,<null>,<null>,<null>,story,https://www.theregister.com/2022/11/14/musk_twitter_rpc_spat/,"{""connection_name"":""hackernews""}"
33607629,Deadweight Loss,2022-11-15T10:47:34Z,iNic,2,false,false,<null>,<null>,<null>,<null>,<null>,<null>,story,https://www.slowboring.com/p/deadweight-loss-explained,"{""connection_name"":""hackernews""}"
33607652,Thanks to KYC/AML the criminals at FTX have details of millions of individuals,2022-11-15T10:50:31Z,MzHN,1,false,false,<null>,<null>,<null>,<null>,<null>,<null>,story,https://twitter.com/sobradob/status/1592131024003411974,"{""connection_name"":""hackernews""}"
33607733,Elon fires senior engineer for discussing him after calling out his team,2022-11-15T11:01:58Z,jiwidi,3,false,false,2,[33607750],<null>,<null>,<null>,<null>,story,https://twitter.com/gergelyorosz/status/1592207663483461632,"{""connection_name"":""hackernews""}"
33607511,Apk.sh,2022-11-15T10:32:27Z,3rmy,1,false,false,1,[33607512],<null>,<null>,<null>,<null>,story,https://github.com/ax/apk.sh,"{""connection_name"":""hackernews""}"
33607817,Sam Bankman Fraud: Inside the Collapse of FTX’s Hollow Empire,2022-11-15T11:15:44Z,noch,1,false,false,<null>,<null>,<null>,<null>,<null>,<null>,story,https://www.coindesk.com/podcasts/the-breakdown-with-nlw/sam-bankman-fraud-inside-the-collapse-of-ftxs-hollow-empire/,"{""connection_name"":""hackernews""}"
33607661,Waymo is using its self-driving taxis to create real-time weather maps |Engadget,2022-11-15T10:51:42Z,isaacfrond,2,false,false,<null>,<null>,<null>,<null>,<null>,<null>,story,https://www.engadget.com/waymo-robotaxi-weather-station-maps-174012064.html,"{""connection_name"":""hackernews""}"
33607724,You can’t out-shoot a teenager: how to play FPS games if you’re over 30,2022-11-15T11:00:38Z,nigerian1981,2,false,false,<null>,<null>,<null>,<null>,<null>,<null>,story,https://www.theguardian.com/games/2022/nov/15/you-cant-out-shoot-a-teenager-how-to-play-first-person-shooters-if-youre-over-30,"{""connection_name"":""hackernews""}"
33607799,Learn Anything by Video,2022-11-15T11:12:46Z,hichamino,1,false,false,<null>,<null>,<null>,<null>,<null>,Please i want to know if someone has posted a link for a  database or a library of video tutorials .. to learn anything by video.<p>I can&#x27;t remember the thread.<p>Thank you,story,<null>,"{""connection_name"":""hackernews""}"
33607761,Cognition in the Wild (1995),2022-11-15T11:06:38Z,shrthnd,1,false,false,<null>,<null>,<null>,<null>,<null>,<null>,story,https://pages.ucsd.edu/~ehutchins/citw.html,"{""connection_name"":""hackernews""}"
33607711,Monitoring your application as a solo founder,2022-11-15T10:58:45Z,rozenmd,4,false,false,<null>,<null>,<null>,<null>,<null>,<null>,story,https://onlineornot.com/how-to-handle-monitoring-solo-founder,"{""connection_name"":""hackernews""}"
