id,title,time,by,score,dead,deleted,descendants,kids,parent,parts,poll,text,type,url,_ctx
32437965,PyPI Package 'Secretslib' Drops Fileless Linux Malware to Mine Monero,2022-08-12T13:06:00Z,kungfudoi,1,false,false,<null>,<null>,<null>,<null>,<null>,<null>,story,https://blog.sonatype.com/pypi-package-secretslib-drops-fileless-linux-malware-to-mine-monero,"{""connection_name"":""hackernews""}"
32438281,The Truth Curve and the Build Curve,2022-08-12T13:26:36Z,firstSpeaker,1,false,false,<null>,<null>,<null>,<null>,<null>,<null>,story,https://giffconstable.com/2021/04/the-truth-curve-and-the-build-curve/,"{""connection_name"":""hackernews""}"
32438208,Levity Polymorphism [pdf],2022-08-12T13:22:25Z,asplake,1,false,false,1,[32438234],<null>,<null>,<null>,<null>,story,https://www.microsoft.com/en-us/research/wp-content/uploads/2016/11/levity-pldi17.pdf,"{""connection_name"":""hackernews""}"
32438251,Tell HN: Reddit mandatory login to see sensitive pages,2022-08-12T13:25:20Z,btzo,1,false,false,<null>,<null>,<null>,<null>,<null>,"If you try to look at reddit.com&#x2F;r&#x2F;nsfw and you’re not logged, you‘ll see now a log in button to see the content of the page. Until yesterday it was just a simple button with I’m over 18 text.",story,<null>,"{""connection_name"":""hackernews""}"
32438249,Ampo: Food Made of Soil,2022-08-12T13:25:08Z,martingoodson,1,false,false,<null>,<null>,<null>,<null>,<null>,<null>,story,https://en.wikipedia.org/wiki/Ampo_(snack),"{""connection_name"":""hackernews""}"
32437969,Five Chinese state-owned companies to delist from NYSE,2022-08-12T13:06:11Z,rntn,2,false,false,<null>,<null>,<null>,<null>,<null>,<null>,story,https://www.reuters.com/business/finance/several-chinese-state-owned-companies-delist-nyse-2022-08-12/,"{""connection_name"":""hackernews""}"
32438059,Tom Mitchell: Machine Learning textbook is now a free to download,2022-08-12T13:12:53Z,mariuz,3,false,false,<null>,<null>,<null>,<null>,<null>,<null>,story,https://twitter.com/tommmitchell/status/1557878699365638147,"{""connection_name"":""hackernews""}"
32438001,Uncommon Uses of Python in Commonly Used Libraries,2022-08-12T13:08:20Z,asicsp,2,false,false,<null>,<null>,<null>,<null>,<null>,<null>,story,https://eugeneyan.com/writing/uncommon-python/,"{""connection_name"":""hackernews""}"
32438016,Overcoming unworthiness to become an entrepreneur,2022-08-12T13:09:24Z,Ope_Welp,1,false,false,1,[32438017],<null>,<null>,<null>,<null>,story,https://www.indiehackers.com/post/overcoming-unworthiness-to-become-an-entrepreneur-db76a301ef,"{""connection_name"":""hackernews""}"
32437999,‘Disturbing’: Experts troubled by Canada’s euthanasia laws,2022-08-12T13:07:59Z,barry-cotter,2,false,false,1,[32438012],<null>,<null>,<null>,<null>,story,https://apnews.com/article/covid-science-health-toronto-7c631558a457188d2bd2b5cfd360a867,"{""connection_name"":""hackernews""}"
32437991,Datacenter Props Up Nvidia as Gaming Sales Collapse,2022-08-12T13:07:26Z,rntn,2,false,false,<null>,<null>,<null>,<null>,<null>,<null>,story,https://www.nextplatform.com/2022/08/08/datacenter-props-up-nvidia-as-gaming-sales-collapse/,"{""connection_name"":""hackernews""}"
32437984,Brightest stars in the night sky can strip Neptune-sized planets to rocky cores,2022-08-12T13:07:00Z,rntn,2,false,false,<null>,<null>,<null>,<null>,<null>,<null>,story,https://phys.org/news/2022-08-brightest-stars-night-sky-neptune-sized.html,"{""connection_name"":""hackernews""}"
32437971,Weather Forecasts and the Lost Art of Common Sense,2022-08-12T13:06:14Z,antihoney,1,false,false,<null>,<null>,<null>,<null>,<null>,<null>,story,https://qalming.bearblog.dev/weather-forecasts-and-the-lost-art-of-common-sense/,"{""connection_name"":""hackernews""}"
32438190,Naysayers (and the Grifters),2022-08-12T13:21:27Z,gmays,1,false,false,<null>,<null>,<null>,<null>,<null>,<null>,story,https://seths.blog/2022/08/naysayers-and-the-grifters/,"{""connection_name"":""hackernews""}"
32438112,"Random thoughts on Arc, Orion, and stuff",2022-08-12T13:15:49Z,vladstudio,1,false,false,<null>,<null>,<null>,<null>,<null>,<null>,story,https://orionfeedback.org/d/2783-random-thoughts-on-arc-orion-and-stuff,"{""connection_name"":""hackernews""}"
32438101,Ask HN: Examples of how social network startups acquired early users?,2022-08-12T13:15:16Z,faizshah,1,false,false,<null>,<null>,<null>,<null>,<null>,"Hi HN,<p>Does anyone know of any articles or stories on how social media sites like SoundCloud, instagram, etc. acquire users in their first year?",story,<null>,"{""connection_name"":""hackernews""}"
32437952,New ‘Langya’ virus identified in China,2022-08-12T13:05:01Z,gmays,1,false,false,<null>,<null>,<null>,<null>,<null>,<null>,story,https://www.nature.com/articles/d41586-022-02175-z,"{""connection_name"":""hackernews""}"
32437613,The Startup Uncertainty Principle,2022-08-12T12:39:51Z,maestrocheddar,2,false,false,<null>,<null>,<null>,<null>,<null>,<null>,story,https://entrepreneurshandbook.co/the-startup-uncertainty-principle-468ff20bf573?gi=b4bd48c2b0d4,"{""connection_name"":""hackernews""}"
32438075,Most Popular Programming Languages Used by DevOps Pros,2022-08-12T13:13:47Z,kiyanwang,1,false,false,<null>,<null>,<null>,<null>,<null>,<null>,story,https://thenewstack.io/25-most-popular-programming-languages-used-by-devops-pros/,"{""connection_name"":""hackernews""}"
32437905,Screens in Screens in Screens,2022-08-12T13:02:22Z,humbugtheman,1,false,false,2,"[32437906,32438096]",<null>,<null>,<null>,<null>,story,https://www.youtube.com/watch?v=Q4OIcwt8vcE,"{""connection_name"":""hackernews""}"
32438158,Redwood: A JavaScript Framework Designed for Startups,2022-08-12T13:18:25Z,kiyanwang,1,false,false,<null>,<null>,<null>,<null>,<null>,<null>,story,https://thenewstack.io/redwood-a-javascript-framework-designed-for-startups/,"{""connection_name"":""hackernews""}"
32438121,How much will the climate bill lower global temperatures?,2022-08-12T13:16:16Z,ethics13,1,false,false,<null>,<null>,<null>,<null>,<null>,<null>,story,https://johnhcochrane.blogspot.com/2022/08/climate-policy-numbers.html,"{""connection_name"":""hackernews""}"
32437960,"A new method boosts wind farms’ energy output, without new equipment",2022-08-12T13:05:48Z,rntn,1,false,false,<null>,<null>,<null>,<null>,<null>,<null>,story,https://news.mit.edu/2022/wind-farm-optimization-energy-flow-0811,"{""connection_name"":""hackernews""}"
32438045,Blood Type Matters More Than We Give It Credit For,2022-08-12T13:12:10Z,nradov,1,false,false,<null>,<null>,<null>,<null>,<null>,<null>,story,https://www.cnet.com/health/medical/blood-type-matters-more-than-we-give-it-credit-for-heart-health/,"{""connection_name"":""hackernews""}"
32437515,All children aged 1 to 9 in London to be offered a dose of polio vaccine,2022-08-12T12:30:42Z,clouddrover,5,false,false,<null>,<null>,<null>,<null>,<null>,<null>,story,https://www.gov.uk/government/news/all-children-aged-1-to-9-in-london-to-be-offered-a-dose-of-polio-vaccine,"{""connection_name"":""hackernews""}"
32437717,"Show HN: Busy – a lean, statically typed build system for GCC Clang MSVC",2022-08-12T12:49:09Z,Rochus,2,false,false,<null>,<null>,<null>,<null>,<null>,<null>,story,https://github.com/rochus-keller/BUSY/blob/main/README.md,"{""connection_name"":""hackernews""}"
32438078,My life is a litmus test,2022-08-12T13:13:52Z,eightturn,1,false,false,<null>,<null>,<null>,<null>,<null>,<null>,story,https://www.deepsouthventures.com/litmus/,"{""connection_name"":""hackernews""}"
32437680,Poll: Distrust of Asian Americans is rising,2022-08-12T12:46:04Z,albatruss,2,false,false,1,[32437681],<null>,<null>,<null>,<null>,story,https://www.axios.com/2022/05/04/asian-americans-covid-hate-survey,"{""connection_name"":""hackernews""}"
32437902,First actual case of bug being found,2022-08-12T13:02:21Z,ar1hant,2,false,false,<null>,<null>,<null>,<null>,<null>,<null>,story,https://americanhistory.si.edu/collections/search/object/nmah_334663,"{""connection_name"":""hackernews""}"
32437870,I developed a game to fix my burnout. It sucks,2022-08-12T12:59:57Z,poga,1,false,false,<null>,<null>,<null>,<null>,<null>,<null>,story,https://devpoga.org/blog/2022-08-12_i_developed_a_game_to_fix_my_burnout_it_sucks/,"{""connection_name"":""hackernews""}"
32437679,Gmail gets approval to move forward with plan to ruin its spam filter,2022-08-12T12:46:02Z,blinkingled,3,false,false,<null>,<null>,<null>,<null>,<null>,<null>,story,https://www.androidpolice.com/gmail-political-spam/,"{""connection_name"":""hackernews""}"
32437525,Deploying Rust web app on Fly.io,2022-08-12T12:31:59Z,datarage,5,false,false,1,[32437526],<null>,<null>,<null>,<null>,story,https://medium.com/@mister-life/deploying-a-rust-web-app-to-fly-io-bonus-the-dockerfile-also-works-for-aws-ecs-ac4731d46f47,"{""connection_name"":""hackernews""}"
32437775,Sftp-server(8) gains support for home-directory request,2022-08-12T12:53:16Z,protomyth,2,false,false,<null>,<null>,<null>,<null>,<null>,<null>,story,https://undeadly.org/cgi?action=article;sid=20220812085037,"{""connection_name"":""hackernews""}"
32437929,"Twitter fails to remove 85% of Islamophobic posts, new study finds",2022-08-12T13:03:53Z,valknut,3,false,false,<null>,<null>,<null>,<null>,<null>,<null>,story,https://apo.org.au/node/318935,"{""connection_name"":""hackernews""}"
32438092,Advertisers Plan to Use ‘Dream-Hacking’ to Implant Branding into Your Dreams,2022-08-12T13:14:45Z,jbotz,1,false,false,<null>,<null>,<null>,<null>,<null>,<null>,story,https://www.contxmedia.com/marketing-implanting-into-dreams-incubation/,"{""connection_name"":""hackernews""}"
32438095,Online Escape Rooms for Coders (and non-coders),2022-08-12T13:14:52Z,O__________O,1,false,false,<null>,<null>,<null>,<null>,<null>,<null>,story,https://escape.codingame.com/,"{""connection_name"":""hackernews""}"
32437490,The Wall Street Putsch,2022-08-12T12:28:55Z,mooreds,2,false,false,<null>,<null>,<null>,<null>,<null>,<null>,story,https://en.wikipedia.org/wiki/Business_Plot,"{""connection_name"":""hackernews""}"
32437863,What if we have NFT ownership not stored on blockchain?,2022-08-12T12:59:39Z,oliversild,1,false,false,1,[32437866],<null>,<null>,<null>,<null>,story,https://twitter.com/OliverSild/status/1558057829918982144,"{""connection_name"":""hackernews""}"
32437778,"In pictures: Heatwaves, drought and wildfires across Europe",2022-08-12T12:53:58Z,hazelnut-tree,2,false,false,<null>,<null>,<null>,<null>,<null>,<null>,story,https://www.bbc.co.uk/news/in-pictures-62497772,"{""connection_name"":""hackernews""}"
32437495,Confusion in the Church-Turing Thesis,2022-08-12T12:29:12Z,nomad41,3,false,false,<null>,<null>,<null>,<null>,<null>,<null>,story,https://arxiv.org/abs/1410.7103,"{""connection_name"":""hackernews""}"
32437716,"Ask HN: What is better for a dev tool? Native Desktop App, or Rich Web App?",2022-08-12T12:49:00Z,umbrellasun,2,false,false,4,"[32438020,32437796,32438137]",<null>,<null>,<null>,"I am working on a dev tool providing an All-in-One user management interface for various databases, deployment tools (e.g., k8s), and logging&#x2F;tracing systems.<p>The idea of having one binary application, you open it, and have everything in there (like IDE) sounds good to me. But I also see that more and more tools combine a backend application (client CLI&#x2F;daemon running in the background) with a rich frontend web application for GUI.<p>Even for a native desktop application, I do not exclude having a daemon running in the background or on a remote server. But the main question is, what&#x27;s better for the user-facing part? Native Desktop or Web App?<p>Which one do you think is preferable for a better user experience?",story,<null>,"{""connection_name"":""hackernews""}"
32437501,Is it classist to be against fast fashion?,2022-08-12T12:29:49Z,0x54MUR41,25,false,false,48,"[32437654,32437817,32437766,32438272,32437671,32438245,32438202,32437833,32438032,32437903,32438205,32437836,32437743,32437724,32437947,32438142,32438006,32438233,32438069,32437706]",<null>,<null>,<null>,<null>,story,https://putthison.com/is-it-classist-to-be-against-fast-fashion/,"{""connection_name"":""hackernews""}"
32437551,A Relativistic Theory of Consciousness,2022-08-12T12:34:10Z,bookofjoe,3,false,false,<null>,[32437662],<null>,<null>,<null>,<null>,story,https://www.frontiersin.org/articles/10.3389/fpsyg.2021.704270/full,"{""connection_name"":""hackernews""}"
32437691,Meditation App Calm Lays Off 20% of Staff,2022-08-12T12:47:06Z,chewz,2,false,false,<null>,<null>,<null>,<null>,<null>,<null>,story,https://www.wsj.com/articles/meditation-app-calm-lays-off-20-of-staff-11660261492,"{""connection_name"":""hackernews""}"
32437651,Greatest talks in 2022 so far?,2022-08-12T12:43:18Z,almonerthis,1,false,false,<null>,<null>,<null>,<null>,<null>,Any talk from a conf that happened this year?,story,<null>,"{""connection_name"":""hackernews""}"
32437830,The Economic Inefficiency of Gift Giving: Why You Shouldn’t Buy Presents,2022-08-12T12:57:56Z,aaraujo002,2,false,false,<null>,<null>,<null>,<null>,<null>,<null>,story,https://fs.blog/the-economic-inefficiency-of-gift-giving-why-you-shouldnt-buy-presents-for-the-holidays/,"{""connection_name"":""hackernews""}"
32437585,Google fined $60M for misleading Australian mobile users about location data,2022-08-12T12:37:53Z,cube00,2,false,false,<null>,<null>,<null>,<null>,<null>,<null>,story,https://www.abc.net.au/news/2022-08-12/google-fined-60m-misleading-mobile-users-location-data/101329790,"{""connection_name"":""hackernews""}"
32438153,We Built an Open Source ML Model Registry with Git,2022-08-12T13:17:51Z,kiyanwang,1,false,false,<null>,<null>,<null>,<null>,<null>,<null>,story,https://thenewstack.io/why-we-built-an-open-source-ml-model-registry-with-git/,"{""connection_name"":""hackernews""}"
32437494,Disappearance of Frederick Valentich,2022-08-12T12:29:11Z,oumua_don17,1,false,false,<null>,<null>,<null>,<null>,<null>,<null>,story,https://en.wikipedia.org/wiki/Disappearance_of_Frederick_Valentich,"{""connection_name"":""hackernews""}"
32437608,Minority Rule,2022-08-12T12:39:29Z,AzzieElbab,1,false,false,<null>,<null>,<null>,<null>,<null>,<null>,story,https://medium.com/incerto/the-most-intolerant-wins-the-dictatorship-of-the-small-minority-3f1f83ce4e15,"{""connection_name"":""hackernews""}"
32437845,Tesla‘s Autopilot Scam,2022-08-12T12:58:54Z,BonoboIO,6,false,false,<null>,<null>,<null>,<null>,<null>,<null>,story,https://www.youtube.com/watch?v=lD6ICmMRSL8,"{""connection_name"":""hackernews""}"

