id,title,time,by,score,dead,deleted,descendants,kids,parent,parts,poll,text,type,url,_ctx
32002303,The Developer Content Playbook That Fuels Twilio's PLG at Scale,2022-07-06T15:21:01Z,gregorymichael,1,false,false,<null>,<null>,<null>,<null>,<null>,<null>,story,https://www.decibel.vc/content/twilio-developer-content-playbook-for-plg,"{""connection_name"":""hackernews""}"
32001819,Twitter vs. Indian Government,2022-07-06T14:49:03Z,ahamedirshad123,2,false,false,<null>,<null>,<null>,<null>,<null>,<null>,story,https://www.bbc.com/news/world-asia-india-62057167,"{""connection_name"":""hackernews""}"
32002047,Nixpacks: App source and Nix packages and Docker = Image,2022-07-06T15:04:14Z,todsacerdoti,2,false,false,<null>,<null>,<null>,<null>,<null>,<null>,story,https://github.com/railwayapp/nixpacks,"{""connection_name"":""hackernews""}"
32001715,Database Read Replicas vs. PolyScale Database Edge Caching,2022-07-06T14:41:43Z,saybar,6,false,false,<null>,<null>,<null>,<null>,<null>,<null>,story,https://www.polyscale.ai/blog/database-read-replicas-vs-polyscale-database-edge-caching/,"{""connection_name"":""hackernews""}"
32002186,"Tips for Productivity, Thinking, and Doing",2022-07-06T15:12:16Z,madiator,1,false,false,<null>,<null>,<null>,<null>,<null>,<null>,story,https://nabeelqu.co/advice,"{""connection_name"":""hackernews""}"
32002057,Python 3.11 is 25% faster than 3.10 on average,2022-07-06T15:05:05Z,hyperbovine,78,false,false,2,"[32002304,32002308]",<null>,<null>,<null>,<null>,story,https://github.com/faster-cpython/ideas/blob/main/main-vs-310.rst,"{""connection_name"":""hackernews""}"
32002061,Maybe AI Isn’t as Scary as We Thought,2022-07-06T15:05:22Z,elsewhen,3,false,false,<null>,<null>,<null>,<null>,<null>,<null>,story,https://www.bloomberg.com/opinion/articles/2022-07-05/dall-e-and-gpt-3-show-how-ai-can-empower-people-not-states,"{""connection_name"":""hackernews""}"
32002069,Mission Pharo Kernel (2016) [pdf],2022-07-06T15:05:52Z,Tomte,1,false,false,<null>,<null>,<null>,<null>,<null>,<null>,story,http://www.esug.org/data/ESUG2016/04-Thursday/1000-1030%20Mission%20Pharo%20Kernel/2016-08-25-Mission-Pharo-Bootstrap-ESUG-2016.pdf,"{""connection_name"":""hackernews""}"
32001624,Buy Now Pay Later Joins the List of Subprime Losers,2022-07-06T14:35:05Z,aruanavekar,2,false,false,<null>,<null>,<null>,<null>,<null>,<null>,story,https://www.washingtonpost.com/business/buy-now-pay-later-joins-the-listof-subprime-losers/2022/07/06/503187fe-fce9-11ec-b39d-71309168014b_story.html,"{""connection_name"":""hackernews""}"
32001852,Ask HN: Effective Methods to Generate Backlinks,2022-07-06T14:50:47Z,aruanavekar,1,false,false,4,"[32001910,32002008]",<null>,<null>,<null>,any best practices or strategies?,story,<null>,"{""connection_name"":""hackernews""}"
32001924,The Mind of a Benevolent Dictator,2022-07-06T14:55:47Z,dbrereton,1,false,false,<null>,<null>,<null>,<null>,<null>,<null>,story,https://dkb.show/post/marcus-aurelius,"{""connection_name"":""hackernews""}"
32002318,A Guide Map for Reading the East Asian Canon,2022-07-06T15:21:50Z,Leary,1,false,false,<null>,<null>,<null>,<null>,<null>,<null>,story,https://scholars-stage.org/a-guide-map-for-reading-the-east-asian-canon/,"{""connection_name"":""hackernews""}"
32001497,New constraints on dark photons using a new dielectric optical haloscope,2022-07-06T14:26:41Z,PaulHoule,1,false,false,<null>,<null>,<null>,<null>,<null>,<null>,story,https://phys.org/news/2022-07-constraints-dark-photons-dielectric-optical.html,"{""connection_name"":""hackernews""}"
32002134,Chinese satellite discovers strongest magnetic field found in the universe,2022-07-06T15:10:06Z,Leary,2,false,false,<null>,<null>,<null>,<null>,<null>,<null>,story,https://www.scmp.com/news/china/science/article/3184331/chinese-astronomy-satellite-discovers-strongest-magnetic-field,"{""connection_name"":""hackernews""}"
32002143,Show HN: Instant Search in NYC Restaurant Menus,2022-07-06T15:10:22Z,casta,3,false,false,<null>,<null>,<null>,<null>,<null>,"A few years ago I wrote a crawler to fetch all NYC menus. I wanted to prove that many specific dishes can&#x27;t be found in NYC restaurants.<p>After more than two years that I had forgotten about the project I decided to clean it up, deal with the css, and put it online.<p>The number of interesting dishes that can be found is actually quite surprising.<p>The backend is written using nodejs without any framework (no db, just a bunch of in memory DS) and vanilla js&#x2F;html&#x2F;css for the frontend.",story,https://c.bitlet.org/ff.html,"{""connection_name"":""hackernews""}"
32001805,Apache Druid vs. Snowflake,2022-07-06T14:48:12Z,rjleone,1,false,false,<null>,<null>,<null>,<null>,<null>,<null>,story,https://imply.io/blog/apache-druid-vs-snowflake/,"{""connection_name"":""hackernews""}"
32001845,Ask HN: At what point does variables that represent money in code become “real”?,2022-07-06T14:50:35Z,dondeee,3,false,false,<null>,[32002022],<null>,<null>,<null>,<null>,story,<null>,"{""connection_name"":""hackernews""}"
32002338,A lethal tick-borne disease is spreading in the US,2022-07-06T15:23:36Z,goplayoutside,1,false,false,<null>,<null>,<null>,<null>,<null>,<null>,story,https://grist.org/health/a-lethal-tick-borne-disease-is-spreading-in-the-us-driven-by-climate-change/,"{""connection_name"":""hackernews""}"
32002036,"Depression in fathers and children linked, regardless of genetic relatedness",2022-07-06T15:03:33Z,PaulHoule,1,false,false,<null>,<null>,<null>,<null>,<null>,<null>,story,https://medicalxpress.com/news/2022-07-depression-fathers-children-linked-genetic.html,"{""connection_name"":""hackernews""}"
32001982,Why Perl is still relevant in 2022,2022-07-06T14:59:36Z,HieronymusBosch,1,false,false,<null>,<null>,<null>,<null>,<null>,<null>,story,https://stackoverflow.blog/2022/07/06/why-perl-is-still-relevant-in-2022/,"{""connection_name"":""hackernews""}"
32002109,New board at Celsius seem to be bankruptcy attorneys,2022-07-06T15:08:21Z,ilamont,2,false,false,<null>,<null>,<null>,<null>,<null>,<null>,story,https://old.reddit.com/r/Buttcoin/comments/vsnbhe/new_board_at_celsius_seem_to_be_bankruptcy/,"{""connection_name"":""hackernews""}"
32001761,"Discovery reveals large, year round ozone hole over tropics",2022-07-06T14:45:11Z,humility,1,false,false,<null>,<null>,<null>,<null>,<null>,<null>,story,https://publishing.aip.org/publications/latest-content/discovery-reveals-large-year-round-ozone-hole-over-tropics/,"{""connection_name"":""hackernews""}"
32002102,"“Titanic” Disaster: Report of the Committee on Commerce, United States Senate [pdf]",2022-07-06T15:08:05Z,miobrien,2,false,false,<null>,<null>,<null>,<null>,<null>,<null>,story,https://www.senate.gov/artandhistory/history/resources/pdf/TitanicReport.pdf,"{""connection_name"":""hackernews""}"
32002274,"Civil servant, administrative experience, PowerBi, GIS and Python. Target roles?",2022-07-06T15:18:20Z,WasimBhai,1,false,false,<null>,<null>,<null>,<null>,<null>,"I can do this: https:&#x2F;&#x2F;app.powerbi.com&#x2F;view?r=eyJrIjoiM2ViNzc5MmQtMDE0ZC00YzAwLWE2YjItYzQ4YWQ1NTdjMmNlIiwidCI6Ijg4OWYxNTI3LWQ4MzYtNGFhNy1iMzE4LTIzYWYwMTUxMGQxYiIsImMiOjl9&amp;pageName=ReportSectionfa5add9a419dcf6577d5<p>I can program in Python and use PowerBi and GIS. Its more than four years though since I left engineering and joined civil service.<p>I also have experience running civilian administration and have succesfully incorporated my technical skills to better public service delivery. Being in the bureaucracy, I have experience dealing with scenarios involving different private and public entities to solve complex issues.<p>What kind of roles can be there for me in the private sector?",story,<null>,"{""connection_name"":""hackernews""}"
32001858,Physicists detect a new type of molecular bond – Physics World,2022-07-06T14:51:03Z,bilsbie,1,false,false,<null>,<null>,<null>,<null>,<null>,<null>,story,https://physicsworld.com/a/physicists-detect-a-new-type-of-molecular-bond/,"{""connection_name"":""hackernews""}"
32001942,Bitwarden Design: Updating the Web Vault Experience – Bitwarden Blog,2022-07-06T14:57:17Z,raybb,3,false,false,<null>,<null>,<null>,<null>,<null>,<null>,story,https://bitwarden.com/blog/bitwarden-design-updating-the-web-vault-experience/,"{""connection_name"":""hackernews""}"
32001886,Probiotic Nutritional Supplement Inhibits Absorption of Ethyl Alcohol in Gut,2022-07-06T14:53:11Z,bookofjoe,1,false,false,<null>,<null>,<null>,<null>,<null>,<null>,story,https://journals.sagepub.com/doi/pdf/10.1177/11786388221108919,"{""connection_name"":""hackernews""}"
32001830,Crescent – The smart cash management platform built for high growth companies,2022-07-06T14:49:35Z,khianablizek,1,false,false,<null>,<null>,<null>,<null>,<null>,<null>,story,https://www.crescent.app/,"{""connection_name"":""hackernews""}"
32002041,The Holy Anarchy of Fun,2022-07-06T15:04:02Z,memorable,1,false,false,<null>,<null>,<null>,<null>,<null>,<null>,story,https://www.commonsense.news/p/the-holy-anarchy-of-fun,"{""connection_name"":""hackernews""}"
32001742,A fake job offer took down the world’s most popular crypto game,2022-07-06T14:43:30Z,danso,54,false,false,22,"[32001964,32002330,32002026,32001921,32002284,32002083,32001968,32002227]",<null>,<null>,<null>,<null>,story,https://www.theblock.co/post/156038/how-a-fake-job-offer-took-down-the-worlds-most-popular-crypto-game,"{""connection_name"":""hackernews""}"
32001523,Why managers need to stop giving people feedback on their personality,2022-07-06T14:28:12Z,adrianhoward,1,false,false,1,[32001810],<null>,<null>,<null>,<null>,story,https://fortune.com/2022/06/15/performance-reviews-bias-gender-race-language-textio-kieran-snyder-aileen-lee/,"{""connection_name"":""hackernews""}"
32001983,IRC technology news from the first half of 2022,2022-07-06T14:59:38Z,nicolaslem,3,false,false,<null>,<null>,<null>,<null>,<null>,<null>,story,https://www.ilmarilauhakangas.fi/irc_technology_news_from_the_first_half_of_2022/,"{""connection_name"":""hackernews""}"
32001834,"Aliens could send quantum messages to Earth, calculations suggest – Science News",2022-07-06T14:49:41Z,bilsbie,1,false,false,<null>,<null>,<null>,<null>,<null>,<null>,story,https://www.sciencenews.org/article/alien-quantum-communication-extraterrestrial-communication-signal,"{""connection_name"":""hackernews""}"
32001859,Files Voluntary Petitions for Chapter 11 Protection to Implement Restructuring,2022-07-06T14:51:03Z,vishnugupta,1,false,false,<null>,<null>,<null>,<null>,<null>,<null>,story,https://www.prnewswire.com/news-releases/voyager-digital-commences-financial-restructuring-process-to-maximize-value-for-all-stakeholders-301581177.html,"{""connection_name"":""hackernews""}"
32001638,DietPi released a new version 8.6,2022-07-06T14:35:56Z,StephanStS,1,false,false,<null>,<null>,<null>,<null>,<null>,"DietPi is a lightweight Debian based Linux distribution for SBCs and server systems, with the option to install desktop environments, too. It ships as minimal image but allows to install complete and ready-to-use software stacks with a set of console based shell dialogs and scripts.<p>The source code is hosted on GitHub: https:&#x2F;&#x2F;github.com&#x2F;MichaIng&#x2F;DietPi
The main website can be found at: https:&#x2F;&#x2F;dietpi.com&#x2F;<p>The project released the new version DietPi v8.6 on July 2nd, 2022.<p>The highlights of this version are:<p><pre><code>    New hardware support for PINE64 Quartz64 Model A, Quartz64 Model B and the SOQuartz Compute Module.
    Prometheus Node Exporter for hardware and OS metrics including HAProxy support.
    Tailscale, a free cloud-hosted VPN service option.
    ZeroTier, another free cloud-hosted VPN service.
    Rclone, quasi the &quot;rsync for cloud storage&quot;.
    PiVPN with unattended first boot installation.
    Amiberry updated to latest version (5.3).
</code></pre>
The full release notes can be found at: https:&#x2F;&#x2F;dietpi.com&#x2F;docs&#x2F;releases&#x2F;v8_6&#x2F;",story,<null>,"{""connection_name"":""hackernews""}"
32002050,A Mirror of Nature,2022-07-06T15:04:24Z,memorable,1,false,false,<null>,<null>,<null>,<null>,<null>,<null>,story,https://inference-review.com/article/a-mirror-of-nature,"{""connection_name"":""hackernews""}"
32002196,MLIR – Multi-Level Intermediate Representation,2022-07-06T15:12:56Z,andsoitis,2,false,false,<null>,<null>,<null>,<null>,<null>,<null>,story,https://mlir.llvm.org/,"{""connection_name"":""hackernews""}"
32002288,Is Scotland the New Cocaine Capital? [video],2022-07-06T15:19:36Z,shifty1,1,false,false,<null>,<null>,<null>,<null>,<null>,<null>,story,https://www.youtube.com/watch?v=a1PfRwOAkxI,"{""connection_name"":""hackernews""}"
32001911,Why Republicans want to redefine 'legislature' in the US Constitution,2022-07-06T14:54:57Z,Tomte,2,false,false,<null>,<null>,<null>,<null>,<null>,<null>,story,https://www.cnn.com/2022/07/05/politics/independent-state-legislature-theory-what-matters/index.html,"{""connection_name"":""hackernews""}"
32001465,German Society Struggles to Find Right Approach to Populists (2019),2022-07-06T14:24:42Z,Tomte,2,false,false,<null>,<null>,<null>,<null>,<null>,<null>,story,https://www.spiegel.de/international/germany/german-society-struggles-to-find-right-approach-to-populists-a-1265498.html,"{""connection_name"":""hackernews""}"
32001463,"Yes, Every Freeware Download Site Is Serving Crapware (Here’s the Proof) (2019)",2022-07-06T14:24:36Z,memorable,7,false,false,1,[32001824],<null>,<null>,<null>,<null>,story,https://www.howtogeek.com/207692/yes-every-freeware-download-site-is-serving-crapware-heres-the-proof/,"{""connection_name"":""hackernews""}"
32001688,"Amazon takes stake in Grubhub, adds food delivery perks to Prime",2022-07-06T14:40:22Z,petilon,1,false,false,<null>,<null>,<null>,<null>,<null>,<null>,story,https://www.cnbc.com/2022/07/06/amazon-takes-stake-in-grubhub-adds-food-delivery-perks-to-prime.html,"{""connection_name"":""hackernews""}"
32001817,Show HN: 3D live tracking two climbers attempting a Sierra Nevada record,2022-07-06T14:48:43Z,closedcontour,2,false,false,1,[32001821],<null>,<null>,<null>,<null>,story,https://www.sps2022.com/tracker/NathanL,"{""connection_name"":""hackernews""}"
32001934,How to Run a Blameless Postmortem,2022-07-06T14:56:36Z,makaimc,1,false,false,1,[32002224],<null>,<null>,<null>,<null>,story,https://www.atlassian.com/incident-management/postmortem/blameless,"{""connection_name"":""hackernews""}"
32001584,Bun is 60% faster than node on an M1 for a Fibonacci number implementation,2022-07-06T14:31:53Z,brrrrrm,1,false,false,<null>,<null>,<null>,<null>,<null>,<null>,story,https://twitter.com/bwasti/status/1544690279650918400,"{""connection_name"":""hackernews""}"
32001744,Airbus’ solar-powered Zephyr S has been flying non-stop for more than 17 days,2022-07-06T14:43:48Z,bookofjoe,3,false,false,<null>,<null>,<null>,<null>,<null>,<null>,story,https://interestingengineering.com/airbus-zephyr-fly-17-days,"{""connection_name"":""hackernews""}"
32001586,No Language Left Behind,2022-07-06T14:31:55Z,jonbaer,3,false,false,<null>,<null>,<null>,<null>,<null>,<null>,story,https://www.louisbouchard.ai/no-language-left-behind/,"{""connection_name"":""hackernews""}"
32001933,Crypto broker Voyager Digital files for bankruptcy,2022-07-06T14:56:29Z,jeremylevy,5,false,false,<null>,<null>,<null>,<null>,<null>,<null>,story,https://techcrunch.com/2022/07/06/crypto-broker-voyager-digital-files-for-bankruptcy/,"{""connection_name"":""hackernews""}"
32001462,The 'war tubas' we used to spot warplanes before radar (2018),2022-07-06T14:24:33Z,Tomte,1,false,false,<null>,<null>,<null>,<null>,<null>,<null>,story,https://www.cnn.com/style/article/war-sound-locators-before-radar/index.html,"{""connection_name"":""hackernews""}"
32001751,Meta AI open-sources NLLB-200 model that translates 200 languages,2022-07-06T14:44:24Z,jkw,12,false,false,<null>,<null>,<null>,<null>,<null>,<null>,story,https://ai.facebook.com/blog/nllb-200-high-quality-machine-translation/,"{""connection_name"":""hackernews""}"
32002118,Streamlit and Snowpark to Visualize ML Models Running on Snowflake,2022-07-06T15:08:54Z,TCR19,1,false,false,<null>,<null>,<null>,<null>,<null>,<null>,story,https://medium.com/@sasha.mitrovich/use-streamlit-to-visualize-your-ml-models-running-on-snowflake-14054b5143b0,"{""connection_name"":""hackernews""}"
32001627,FDA suspends Juul ban as company appeals,2022-07-06T14:35:07Z,kdamica,20,false,false,35,"[32002301,32002305,32002237,32001839]",<null>,<null>,<null>,<null>,story,https://www.wsj.com/articles/juul-can-keep-selling-its-products-in-u-s-while-it-appeals-ban-fda-says-11657067282,"{""connection_name"":""hackernews""}"
32001898,Quart is now a Pallets project,2022-07-06T14:54:17Z,todsacerdoti,2,false,false,<null>,<null>,<null>,<null>,<null>,<null>,story,https://palletsprojects.com/blog/quart-pallets/,"{""connection_name"":""hackernews""}"
32002140,Is MoneyLion pivoting away from consumer banking?,2022-07-06T15:10:18Z,kazanins,1,false,false,<null>,<null>,<null>,<null>,<null>,<null>,story,https://www.popularfintech.com/p/moneylion-q1-2022-earnings-review,"{""connection_name"":""hackernews""}"
32002151,SaaS tier management (features/permissions),2022-07-06T15:10:41Z,Gns89,1,false,false,<null>,<null>,<null>,<null>,<null>,"Hi<p>I would like to know how you usually implement tiers in your SaaS applications and how do you handle the provisioning of features and permissions for users in your services?<p>Also, how you handle tier&#x2F;subscription upgrading or downgrading for your users as far as feature management?<p>Thanks in advance",story,<null>,"{""connection_name"":""hackernews""}"

